
         /\      Grafana   /‾‾/  
    /\  /  \     |\  __   /  /   
   /  \/    \    | |/ /  /   ‾‾\ 
  /          \   |   (  |  (‾)  |
 / __________ \  |_|\_\  \_____/ 


     execution: local
        script: /Users/akshaybapat/drafted-mvp/tests/load/k6_jobs_transient.js
        output: -

     scenarios: (100.00%) 1 scenario, 8 max VUs, 4m30s max duration (incl. graceful stop):
              * transient_retry_ingest: 8 looping VUs for 4m0s (gracefulStop: 30s)


running (0m01.0s), 8/8 VUs, 34 complete and 0 interrupted iterations
transient_retry_ingest   [   0% ] 8 VUs  0m01.0s/4m0s

running (0m02.0s), 8/8 VUs, 82 complete and 0 interrupted iterations
transient_retry_ingest   [   1% ] 8 VUs  0m02.0s/4m0s

running (0m03.0s), 8/8 VUs, 125 complete and 0 interrupted iterations
transient_retry_ingest   [   1% ] 8 VUs  0m03.0s/4m0s

running (0m04.0s), 8/8 VUs, 168 complete and 0 interrupted iterations
transient_retry_ingest   [   2% ] 8 VUs  0m04.0s/4m0s

running (0m05.0s), 8/8 VUs, 216 complete and 0 interrupted iterations
transient_retry_ingest   [   2% ] 8 VUs  0m05.0s/4m0s

running (0m06.0s), 8/8 VUs, 264 complete and 0 interrupted iterations
transient_retry_ingest   [   2% ] 8 VUs  0m06.0s/4m0s

running (0m07.0s), 8/8 VUs, 305 complete and 0 interrupted iterations
transient_retry_ingest   [   3% ] 8 VUs  0m07.0s/4m0s

running (0m08.0s), 8/8 VUs, 348 complete and 0 interrupted iterations
transient_retry_ingest   [   3% ] 8 VUs  0m08.0s/4m0s

running (0m09.0s), 8/8 VUs, 396 complete and 0 interrupted iterations
transient_retry_ingest   [   4% ] 8 VUs  0m09.0s/4m0s

running (0m10.0s), 8/8 VUs, 445 complete and 0 interrupted iterations
transient_retry_ingest   [   4% ] 8 VUs  0m10.0s/4m0s

running (0m11.0s), 8/8 VUs, 495 complete and 0 interrupted iterations
transient_retry_ingest   [   5% ] 8 VUs  0m11.0s/4m0s

running (0m12.0s), 8/8 VUs, 543 complete and 0 interrupted iterations
transient_retry_ingest   [   5% ] 8 VUs  0m12.0s/4m0s

running (0m13.0s), 8/8 VUs, 593 complete and 0 interrupted iterations
transient_retry_ingest   [   5% ] 8 VUs  0m13.0s/4m0s

running (0m14.0s), 8/8 VUs, 636 complete and 0 interrupted iterations
transient_retry_ingest   [   6% ] 8 VUs  0m14.0s/4m0s

running (0m15.0s), 8/8 VUs, 686 complete and 0 interrupted iterations
transient_retry_ingest   [   6% ] 8 VUs  0m15.0s/4m0s

running (0m16.0s), 8/8 VUs, 734 complete and 0 interrupted iterations
transient_retry_ingest   [   7% ] 8 VUs  0m16.0s/4m0s

running (0m17.0s), 8/8 VUs, 783 complete and 0 interrupted iterations
transient_retry_ingest   [   7% ] 8 VUs  0m17.0s/4m0s

running (0m18.0s), 8/8 VUs, 831 complete and 0 interrupted iterations
transient_retry_ingest   [   7% ] 8 VUs  0m18.0s/4m0s

running (0m19.0s), 8/8 VUs, 879 complete and 0 interrupted iterations
transient_retry_ingest   [   8% ] 8 VUs  0m19.0s/4m0s

running (0m20.0s), 8/8 VUs, 927 complete and 0 interrupted iterations
transient_retry_ingest   [   8% ] 8 VUs  0m20.0s/4m0s

running (0m21.0s), 8/8 VUs, 978 complete and 0 interrupted iterations
transient_retry_ingest   [   9% ] 8 VUs  0m21.0s/4m0s

running (0m22.0s), 8/8 VUs, 1020 complete and 0 interrupted iterations
transient_retry_ingest   [   9% ] 8 VUs  0m22.0s/4m0s

running (0m23.0s), 8/8 VUs, 1068 complete and 0 interrupted iterations
transient_retry_ingest   [  10% ] 8 VUs  0m23.0s/4m0s

running (0m24.0s), 8/8 VUs, 1116 complete and 0 interrupted iterations
transient_retry_ingest   [  10% ] 8 VUs  0m24.0s/4m0s

running (0m25.0s), 8/8 VUs, 1164 complete and 0 interrupted iterations
transient_retry_ingest   [  10% ] 8 VUs  0m25.0s/4m0s

running (0m26.0s), 8/8 VUs, 1212 complete and 0 interrupted iterations
transient_retry_ingest   [  11% ] 8 VUs  0m26.0s/4m0s

running (0m27.0s), 8/8 VUs, 1261 complete and 0 interrupted iterations
transient_retry_ingest   [  11% ] 8 VUs  0m27.0s/4m0s

running (0m28.0s), 8/8 VUs, 1309 complete and 0 interrupted iterations
transient_retry_ingest   [  12% ] 8 VUs  0m28.0s/4m0s

running (0m29.0s), 8/8 VUs, 1357 complete and 0 interrupted iterations
transient_retry_ingest   [  12% ] 8 VUs  0m29.0s/4m0s

running (0m30.0s), 8/8 VUs, 1405 complete and 0 interrupted iterations
transient_retry_ingest   [  12% ] 8 VUs  0m30.0s/4m0s

running (0m31.0s), 8/8 VUs, 1453 complete and 0 interrupted iterations
transient_retry_ingest   [  13% ] 8 VUs  0m31.0s/4m0s

running (0m32.0s), 8/8 VUs, 1501 complete and 0 interrupted iterations
transient_retry_ingest   [  13% ] 8 VUs  0m32.0s/4m0s

running (0m33.0s), 8/8 VUs, 1549 complete and 0 interrupted iterations
transient_retry_ingest   [  14% ] 8 VUs  0m33.0s/4m0s

running (0m34.0s), 8/8 VUs, 1597 complete and 0 interrupted iterations
transient_retry_ingest   [  14% ] 8 VUs  0m34.0s/4m0s

running (0m35.0s), 8/8 VUs, 1647 complete and 0 interrupted iterations
transient_retry_ingest   [  15% ] 8 VUs  0m35.0s/4m0s

running (0m36.0s), 8/8 VUs, 1698 complete and 0 interrupted iterations
transient_retry_ingest   [  15% ] 8 VUs  0m36.0s/4m0s

running (0m37.0s), 8/8 VUs, 1746 complete and 0 interrupted iterations
transient_retry_ingest   [  15% ] 8 VUs  0m37.0s/4m0s

running (0m38.0s), 8/8 VUs, 1794 complete and 0 interrupted iterations
transient_retry_ingest   [  16% ] 8 VUs  0m38.0s/4m0s

running (0m39.0s), 8/8 VUs, 1842 complete and 0 interrupted iterations
transient_retry_ingest   [  16% ] 8 VUs  0m39.0s/4m0s

running (0m40.0s), 8/8 VUs, 1890 complete and 0 interrupted iterations
transient_retry_ingest   [  17% ] 8 VUs  0m40.0s/4m0s

running (0m41.0s), 8/8 VUs, 1938 complete and 0 interrupted iterations
transient_retry_ingest   [  17% ] 8 VUs  0m41.0s/4m0s

running (0m42.0s), 8/8 VUs, 1986 complete and 0 interrupted iterations
transient_retry_ingest   [  17% ] 8 VUs  0m42.0s/4m0s

running (0m43.0s), 8/8 VUs, 2033 complete and 0 interrupted iterations
transient_retry_ingest   [  18% ] 8 VUs  0m43.0s/4m0s

running (0m44.0s), 8/8 VUs, 2077 complete and 0 interrupted iterations
transient_retry_ingest   [  18% ] 8 VUs  0m44.0s/4m0s

running (0m45.0s), 8/8 VUs, 2125 complete and 0 interrupted iterations
transient_retry_ingest   [  19% ] 8 VUs  0m45.0s/4m0s

running (0m46.0s), 8/8 VUs, 2173 complete and 0 interrupted iterations
transient_retry_ingest   [  19% ] 8 VUs  0m46.0s/4m0s

running (0m47.0s), 8/8 VUs, 2225 complete and 0 interrupted iterations
transient_retry_ingest   [  20% ] 8 VUs  0m47.0s/4m0s

running (0m48.0s), 8/8 VUs, 2273 complete and 0 interrupted iterations
transient_retry_ingest   [  20% ] 8 VUs  0m48.0s/4m0s

running (0m49.0s), 8/8 VUs, 2321 complete and 0 interrupted iterations
transient_retry_ingest   [  20% ] 8 VUs  0m49.0s/4m0s

running (0m50.0s), 8/8 VUs, 2369 complete and 0 interrupted iterations
transient_retry_ingest   [  21% ] 8 VUs  0m50.0s/4m0s

running (0m51.0s), 8/8 VUs, 2417 complete and 0 interrupted iterations
transient_retry_ingest   [  21% ] 8 VUs  0m51.0s/4m0s

running (0m52.0s), 8/8 VUs, 2465 complete and 0 interrupted iterations
transient_retry_ingest   [  22% ] 8 VUs  0m52.0s/4m0s

running (0m53.0s), 8/8 VUs, 2513 complete and 0 interrupted iterations
transient_retry_ingest   [  22% ] 8 VUs  0m53.0s/4m0s

running (0m54.0s), 8/8 VUs, 2560 complete and 0 interrupted iterations
transient_retry_ingest   [  22% ] 8 VUs  0m54.0s/4m0s

running (0m55.0s), 8/8 VUs, 2613 complete and 0 interrupted iterations
transient_retry_ingest   [  23% ] 8 VUs  0m55.0s/4m0s

running (0m56.0s), 8/8 VUs, 2661 complete and 0 interrupted iterations
transient_retry_ingest   [  23% ] 8 VUs  0m56.0s/4m0s

running (0m57.0s), 8/8 VUs, 2709 complete and 0 interrupted iterations
transient_retry_ingest   [  24% ] 8 VUs  0m57.0s/4m0s

running (0m58.0s), 8/8 VUs, 2757 complete and 0 interrupted iterations
transient_retry_ingest   [  24% ] 8 VUs  0m58.0s/4m0s

running (0m59.0s), 8/8 VUs, 2805 complete and 0 interrupted iterations
transient_retry_ingest   [  25% ] 8 VUs  0m59.0s/4m0s

running (1m00.0s), 8/8 VUs, 2854 complete and 0 interrupted iterations
transient_retry_ingest   [  25% ] 8 VUs  1m00.0s/4m0s

running (1m01.0s), 8/8 VUs, 2903 complete and 0 interrupted iterations
transient_retry_ingest   [  25% ] 8 VUs  1m01.0s/4m0s

running (1m02.0s), 8/8 VUs, 2951 complete and 0 interrupted iterations
transient_retry_ingest   [  26% ] 8 VUs  1m02.0s/4m0s

running (1m03.0s), 8/8 VUs, 2999 complete and 0 interrupted iterations
transient_retry_ingest   [  26% ] 8 VUs  1m03.0s/4m0s

running (1m04.0s), 8/8 VUs, 3048 complete and 0 interrupted iterations
transient_retry_ingest   [  27% ] 8 VUs  1m04.0s/4m0s

running (1m05.0s), 8/8 VUs, 3098 complete and 0 interrupted iterations
transient_retry_ingest   [  27% ] 8 VUs  1m05.0s/4m0s

running (1m06.0s), 8/8 VUs, 3147 complete and 0 interrupted iterations
transient_retry_ingest   [  27% ] 8 VUs  1m06.0s/4m0s

running (1m07.0s), 8/8 VUs, 3195 complete and 0 interrupted iterations
transient_retry_ingest   [  28% ] 8 VUs  1m07.0s/4m0s

running (1m08.0s), 8/8 VUs, 3243 complete and 0 interrupted iterations
transient_retry_ingest   [  28% ] 8 VUs  1m08.0s/4m0s

running (1m09.0s), 8/8 VUs, 3291 complete and 0 interrupted iterations
transient_retry_ingest   [  29% ] 8 VUs  1m09.0s/4m0s

running (1m10.0s), 8/8 VUs, 3335 complete and 0 interrupted iterations
transient_retry_ingest   [  29% ] 8 VUs  1m10.0s/4m0s

running (1m11.0s), 8/8 VUs, 3385 complete and 0 interrupted iterations
transient_retry_ingest   [  30% ] 8 VUs  1m11.0s/4m0s

running (1m12.0s), 8/8 VUs, 3434 complete and 0 interrupted iterations
transient_retry_ingest   [  30% ] 8 VUs  1m12.0s/4m0s

running (1m13.0s), 8/8 VUs, 3487 complete and 0 interrupted iterations
transient_retry_ingest   [  30% ] 8 VUs  1m13.0s/4m0s

running (1m14.0s), 8/8 VUs, 3536 complete and 0 interrupted iterations
transient_retry_ingest   [  31% ] 8 VUs  1m14.0s/4m0s

running (1m15.0s), 8/8 VUs, 3586 complete and 0 interrupted iterations
transient_retry_ingest   [  31% ] 8 VUs  1m15.0s/4m0s

running (1m16.0s), 8/8 VUs, 3634 complete and 0 interrupted iterations
transient_retry_ingest   [  32% ] 8 VUs  1m16.0s/4m0s

running (1m17.0s), 8/8 VUs, 3685 complete and 0 interrupted iterations
transient_retry_ingest   [  32% ] 8 VUs  1m17.0s/4m0s

running (1m18.0s), 8/8 VUs, 3734 complete and 0 interrupted iterations
transient_retry_ingest   [  32% ] 8 VUs  1m18.0s/4m0s

running (1m19.0s), 8/8 VUs, 3782 complete and 0 interrupted iterations
transient_retry_ingest   [  33% ] 8 VUs  1m19.0s/4m0s

running (1m20.0s), 8/8 VUs, 3831 complete and 0 interrupted iterations
transient_retry_ingest   [  33% ] 8 VUs  1m20.0s/4m0s

running (1m21.0s), 8/8 VUs, 3879 complete and 0 interrupted iterations
transient_retry_ingest   [  34% ] 8 VUs  1m21.0s/4m0s

running (1m22.0s), 8/8 VUs, 3927 complete and 0 interrupted iterations
transient_retry_ingest   [  34% ] 8 VUs  1m22.0s/4m0s

running (1m23.0s), 8/8 VUs, 3975 complete and 0 interrupted iterations
transient_retry_ingest   [  35% ] 8 VUs  1m23.0s/4m0s

running (1m24.0s), 8/8 VUs, 4018 complete and 0 interrupted iterations
transient_retry_ingest   [  35% ] 8 VUs  1m24.0s/4m0s

running (1m25.0s), 8/8 VUs, 4066 complete and 0 interrupted iterations
transient_retry_ingest   [  35% ] 8 VUs  1m25.0s/4m0s

running (1m26.0s), 8/8 VUs, 4114 complete and 0 interrupted iterations
transient_retry_ingest   [  36% ] 8 VUs  1m26.0s/4m0s

running (1m27.0s), 8/8 VUs, 4162 complete and 0 interrupted iterations
transient_retry_ingest   [  36% ] 8 VUs  1m27.0s/4m0s

running (1m28.0s), 8/8 VUs, 4213 complete and 0 interrupted iterations
transient_retry_ingest   [  37% ] 8 VUs  1m28.0s/4m0s

running (1m29.0s), 8/8 VUs, 4261 complete and 0 interrupted iterations
transient_retry_ingest   [  37% ] 8 VUs  1m29.0s/4m0s

running (1m30.0s), 8/8 VUs, 4309 complete and 0 interrupted iterations
transient_retry_ingest   [  37% ] 8 VUs  1m30.0s/4m0s

running (1m31.0s), 8/8 VUs, 4349 complete and 0 interrupted iterations
transient_retry_ingest   [  38% ] 8 VUs  1m31.0s/4m0s

running (1m32.0s), 8/8 VUs, 4397 complete and 0 interrupted iterations
transient_retry_ingest   [  38% ] 8 VUs  1m32.0s/4m0s

running (1m33.0s), 8/8 VUs, 4445 complete and 0 interrupted iterations
transient_retry_ingest   [  39% ] 8 VUs  1m33.0s/4m0s

running (1m34.0s), 8/8 VUs, 4493 complete and 0 interrupted iterations
transient_retry_ingest   [  39% ] 8 VUs  1m34.0s/4m0s

running (1m35.0s), 8/8 VUs, 4541 complete and 0 interrupted iterations
transient_retry_ingest   [  40% ] 8 VUs  1m35.0s/4m0s

running (1m36.0s), 8/8 VUs, 4590 complete and 0 interrupted iterations
transient_retry_ingest   [  40% ] 8 VUs  1m36.0s/4m0s

running (1m37.0s), 8/8 VUs, 4641 complete and 0 interrupted iterations
transient_retry_ingest   [  40% ] 8 VUs  1m37.0s/4m0s

running (1m38.0s), 8/8 VUs, 4689 complete and 0 interrupted iterations
transient_retry_ingest   [  41% ] 8 VUs  1m38.0s/4m0s

running (1m39.0s), 8/8 VUs, 4738 complete and 0 interrupted iterations
transient_retry_ingest   [  41% ] 8 VUs  1m39.0s/4m0s

running (1m40.0s), 8/8 VUs, 4788 complete and 0 interrupted iterations
transient_retry_ingest   [  42% ] 8 VUs  1m40.0s/4m0s

running (1m41.0s), 8/8 VUs, 4836 complete and 0 interrupted iterations
transient_retry_ingest   [  42% ] 8 VUs  1m41.0s/4m0s

running (1m42.0s), 8/8 VUs, 4884 complete and 0 interrupted iterations
transient_retry_ingest   [  42% ] 8 VUs  1m42.0s/4m0s

running (1m43.0s), 8/8 VUs, 4932 complete and 0 interrupted iterations
transient_retry_ingest   [  43% ] 8 VUs  1m43.0s/4m0s

running (1m44.0s), 8/8 VUs, 4980 complete and 0 interrupted iterations
transient_retry_ingest   [  43% ] 8 VUs  1m44.0s/4m0s

running (1m45.0s), 8/8 VUs, 5026 complete and 0 interrupted iterations
transient_retry_ingest   [  44% ] 8 VUs  1m45.0s/4m0s

running (1m46.0s), 8/8 VUs, 5079 complete and 0 interrupted iterations
transient_retry_ingest   [  44% ] 8 VUs  1m46.0s/4m0s

running (1m47.0s), 8/8 VUs, 5127 complete and 0 interrupted iterations
transient_retry_ingest   [  45% ] 8 VUs  1m47.0s/4m0s

running (1m48.0s), 8/8 VUs, 5167 complete and 0 interrupted iterations
transient_retry_ingest   [  45% ] 8 VUs  1m48.0s/4m0s

running (1m49.0s), 8/8 VUs, 5215 complete and 0 interrupted iterations
transient_retry_ingest   [  45% ] 8 VUs  1m49.0s/4m0s

running (1m50.0s), 8/8 VUs, 5263 complete and 0 interrupted iterations
transient_retry_ingest   [  46% ] 8 VUs  1m50.0s/4m0s

running (1m51.0s), 8/8 VUs, 5311 complete and 0 interrupted iterations
transient_retry_ingest   [  46% ] 8 VUs  1m51.0s/4m0s

running (1m52.0s), 8/8 VUs, 5359 complete and 0 interrupted iterations
transient_retry_ingest   [  47% ] 8 VUs  1m52.0s/4m0s

running (1m53.0s), 8/8 VUs, 5407 complete and 0 interrupted iterations
transient_retry_ingest   [  47% ] 8 VUs  1m53.0s/4m0s

running (1m54.0s), 8/8 VUs, 5455 complete and 0 interrupted iterations
transient_retry_ingest   [  47% ] 8 VUs  1m54.0s/4m0s

running (1m55.0s), 8/8 VUs, 5506 complete and 0 interrupted iterations
transient_retry_ingest   [  48% ] 8 VUs  1m55.0s/4m0s

running (1m56.0s), 8/8 VUs, 5554 complete and 0 interrupted iterations
transient_retry_ingest   [  48% ] 8 VUs  1m56.0s/4m0s

running (1m57.0s), 8/8 VUs, 5602 complete and 0 interrupted iterations
transient_retry_ingest   [  49% ] 8 VUs  1m57.0s/4m0s

running (1m58.0s), 8/8 VUs, 5651 complete and 0 interrupted iterations
transient_retry_ingest   [  49% ] 8 VUs  1m58.0s/4m0s

running (1m59.0s), 8/8 VUs, 5699 complete and 0 interrupted iterations
transient_retry_ingest   [  50% ] 8 VUs  1m59.0s/4m0s

running (2m00.0s), 8/8 VUs, 5747 complete and 0 interrupted iterations
transient_retry_ingest   [  50% ] 8 VUs  2m00.0s/4m0s

running (2m01.0s), 8/8 VUs, 5795 complete and 0 interrupted iterations
transient_retry_ingest   [  50% ] 8 VUs  2m01.0s/4m0s

running (2m02.0s), 8/8 VUs, 5843 complete and 0 interrupted iterations
transient_retry_ingest   [  51% ] 8 VUs  2m02.0s/4m0s

running (2m03.0s), 8/8 VUs, 5887 complete and 0 interrupted iterations
transient_retry_ingest   [  51% ] 8 VUs  2m03.0s/4m0s

running (2m04.0s), 8/8 VUs, 5936 complete and 0 interrupted iterations
transient_retry_ingest   [  52% ] 8 VUs  2m04.0s/4m0s

running (2m05.0s), 8/8 VUs, 5986 complete and 0 interrupted iterations
transient_retry_ingest   [  52% ] 8 VUs  2m05.0s/4m0s

running (2m06.0s), 8/8 VUs, 6030 complete and 0 interrupted iterations
transient_retry_ingest   [  52% ] 8 VUs  2m06.0s/4m0s

running (2m07.0s), 8/8 VUs, 6082 complete and 0 interrupted iterations
transient_retry_ingest   [  53% ] 8 VUs  2m07.0s/4m0s

running (2m08.0s), 8/8 VUs, 6126 complete and 0 interrupted iterations
transient_retry_ingest   [  53% ] 8 VUs  2m08.0s/4m0s

running (2m09.0s), 8/8 VUs, 6174 complete and 0 interrupted iterations
transient_retry_ingest   [  54% ] 8 VUs  2m09.0s/4m0s

running (2m10.0s), 8/8 VUs, 6225 complete and 0 interrupted iterations
transient_retry_ingest   [  54% ] 8 VUs  2m10.0s/4m0s

running (2m11.0s), 8/8 VUs, 6275 complete and 0 interrupted iterations
transient_retry_ingest   [  55% ] 8 VUs  2m11.0s/4m0s

running (2m12.0s), 8/8 VUs, 6324 complete and 0 interrupted iterations
transient_retry_ingest   [  55% ] 8 VUs  2m12.0s/4m0s

running (2m13.0s), 8/8 VUs, 6373 complete and 0 interrupted iterations
transient_retry_ingest   [  55% ] 8 VUs  2m13.0s/4m0s

running (2m14.0s), 8/8 VUs, 6423 complete and 0 interrupted iterations
transient_retry_ingest   [  56% ] 8 VUs  2m14.0s/4m0s

running (2m15.0s), 8/8 VUs, 6471 complete and 0 interrupted iterations
transient_retry_ingest   [  56% ] 8 VUs  2m15.0s/4m0s

running (2m16.0s), 8/8 VUs, 6519 complete and 0 interrupted iterations
transient_retry_ingest   [  57% ] 8 VUs  2m16.0s/4m0s

running (2m17.0s), 8/8 VUs, 6569 complete and 0 interrupted iterations
transient_retry_ingest   [  57% ] 8 VUs  2m17.0s/4m0s

running (2m18.0s), 8/8 VUs, 6618 complete and 0 interrupted iterations
transient_retry_ingest   [  57% ] 8 VUs  2m18.0s/4m0s

running (2m19.0s), 8/8 VUs, 6666 complete and 0 interrupted iterations
transient_retry_ingest   [  58% ] 8 VUs  2m19.0s/4m0s

running (2m20.0s), 8/8 VUs, 6715 complete and 0 interrupted iterations
transient_retry_ingest   [  58% ] 8 VUs  2m20.0s/4m0s

running (2m21.0s), 8/8 VUs, 6764 complete and 0 interrupted iterations
transient_retry_ingest   [  59% ] 8 VUs  2m21.0s/4m0s

running (2m22.0s), 8/8 VUs, 6814 complete and 0 interrupted iterations
transient_retry_ingest   [  59% ] 8 VUs  2m22.0s/4m0s

running (2m23.0s), 8/8 VUs, 6863 complete and 0 interrupted iterations
transient_retry_ingest   [  60% ] 8 VUs  2m23.0s/4m0s

running (2m24.0s), 8/8 VUs, 6911 complete and 0 interrupted iterations
transient_retry_ingest   [  60% ] 8 VUs  2m24.0s/4m0s

running (2m25.0s), 8/8 VUs, 6960 complete and 0 interrupted iterations
transient_retry_ingest   [  60% ] 8 VUs  2m25.0s/4m0s

running (2m26.0s), 8/8 VUs, 7011 complete and 0 interrupted iterations
transient_retry_ingest   [  61% ] 8 VUs  2m26.0s/4m0s

running (2m27.0s), 8/8 VUs, 7053 complete and 0 interrupted iterations
transient_retry_ingest   [  61% ] 8 VUs  2m27.0s/4m0s

running (2m28.0s), 8/8 VUs, 7103 complete and 0 interrupted iterations
transient_retry_ingest   [  62% ] 8 VUs  2m28.0s/4m0s

running (2m29.0s), 8/8 VUs, 7151 complete and 0 interrupted iterations
transient_retry_ingest   [  62% ] 8 VUs  2m29.0s/4m0s

running (2m30.0s), 8/8 VUs, 7199 complete and 0 interrupted iterations
transient_retry_ingest   [  62% ] 8 VUs  2m30.0s/4m0s

running (2m31.0s), 8/8 VUs, 7247 complete and 0 interrupted iterations
transient_retry_ingest   [  63% ] 8 VUs  2m31.0s/4m0s

running (2m32.0s), 8/8 VUs, 7297 complete and 0 interrupted iterations
transient_retry_ingest   [  63% ] 8 VUs  2m32.0s/4m0s

running (2m33.0s), 8/8 VUs, 7351 complete and 0 interrupted iterations
transient_retry_ingest   [  64% ] 8 VUs  2m33.0s/4m0s

running (2m34.0s), 8/8 VUs, 7397 complete and 0 interrupted iterations
transient_retry_ingest   [  64% ] 8 VUs  2m34.0s/4m0s

running (2m35.0s), 8/8 VUs, 7445 complete and 0 interrupted iterations
transient_retry_ingest   [  65% ] 8 VUs  2m35.0s/4m0s

running (2m36.0s), 8/8 VUs, 7494 complete and 0 interrupted iterations
transient_retry_ingest   [  65% ] 8 VUs  2m36.0s/4m0s

running (2m37.0s), 8/8 VUs, 7545 complete and 0 interrupted iterations
transient_retry_ingest   [  65% ] 8 VUs  2m37.0s/4m0s

running (2m38.0s), 8/8 VUs, 7591 complete and 0 interrupted iterations
transient_retry_ingest   [  66% ] 8 VUs  2m38.0s/4m0s

running (2m39.0s), 8/8 VUs, 7641 complete and 0 interrupted iterations
transient_retry_ingest   [  66% ] 8 VUs  2m39.0s/4m0s

running (2m40.0s), 8/8 VUs, 7691 complete and 0 interrupted iterations
transient_retry_ingest   [  67% ] 8 VUs  2m40.0s/4m0s

running (2m41.0s), 8/8 VUs, 7734 complete and 0 interrupted iterations
transient_retry_ingest   [  67% ] 8 VUs  2m41.0s/4m0s

running (2m42.0s), 8/8 VUs, 7784 complete and 0 interrupted iterations
transient_retry_ingest   [  67% ] 8 VUs  2m42.0s/4m0s

running (2m43.0s), 8/8 VUs, 7834 complete and 0 interrupted iterations
transient_retry_ingest   [  68% ] 8 VUs  2m43.0s/4m0s

running (2m44.0s), 8/8 VUs, 7882 complete and 0 interrupted iterations
transient_retry_ingest   [  68% ] 8 VUs  2m44.0s/4m0s

running (2m45.0s), 8/8 VUs, 7930 complete and 0 interrupted iterations
transient_retry_ingest   [  69% ] 8 VUs  2m45.0s/4m0s

running (2m46.0s), 8/8 VUs, 7978 complete and 0 interrupted iterations
transient_retry_ingest   [  69% ] 8 VUs  2m46.0s/4m0s

running (2m47.0s), 8/8 VUs, 8026 complete and 0 interrupted iterations
transient_retry_ingest   [  70% ] 8 VUs  2m47.0s/4m0s

running (2m48.0s), 8/8 VUs, 8074 complete and 0 interrupted iterations
transient_retry_ingest   [  70% ] 8 VUs  2m48.0s/4m0s

running (2m49.0s), 8/8 VUs, 8126 complete and 0 interrupted iterations
transient_retry_ingest   [  70% ] 8 VUs  2m49.0s/4m0s

running (2m50.0s), 8/8 VUs, 8167 complete and 0 interrupted iterations
transient_retry_ingest   [  71% ] 8 VUs  2m50.0s/4m0s

running (2m51.0s), 8/8 VUs, 8216 complete and 0 interrupted iterations
transient_retry_ingest   [  71% ] 8 VUs  2m51.0s/4m0s

running (2m52.0s), 8/8 VUs, 8265 complete and 0 interrupted iterations
transient_retry_ingest   [  72% ] 8 VUs  2m52.0s/4m0s

running (2m53.0s), 8/8 VUs, 8313 complete and 0 interrupted iterations
transient_retry_ingest   [  72% ] 8 VUs  2m53.0s/4m0s

running (2m54.0s), 8/8 VUs, 8365 complete and 0 interrupted iterations
transient_retry_ingest   [  72% ] 8 VUs  2m54.0s/4m0s

running (2m55.0s), 8/8 VUs, 8409 complete and 0 interrupted iterations
transient_retry_ingest   [  73% ] 8 VUs  2m55.0s/4m0s

running (2m56.0s), 8/8 VUs, 8457 complete and 0 interrupted iterations
transient_retry_ingest   [  73% ] 8 VUs  2m56.0s/4m0s

running (2m57.0s), 8/8 VUs, 8506 complete and 0 interrupted iterations
transient_retry_ingest   [  74% ] 8 VUs  2m57.0s/4m0s

running (2m58.0s), 8/8 VUs, 8554 complete and 0 interrupted iterations
transient_retry_ingest   [  74% ] 8 VUs  2m58.0s/4m0s

running (2m59.0s), 8/8 VUs, 8603 complete and 0 interrupted iterations
transient_retry_ingest   [  75% ] 8 VUs  2m59.0s/4m0s

running (3m00.0s), 8/8 VUs, 8646 complete and 0 interrupted iterations
transient_retry_ingest   [  75% ] 8 VUs  3m00.0s/4m0s

running (3m01.0s), 8/8 VUs, 8695 complete and 0 interrupted iterations
transient_retry_ingest   [  75% ] 8 VUs  3m01.0s/4m0s

running (3m02.0s), 8/8 VUs, 8746 complete and 0 interrupted iterations
transient_retry_ingest   [  76% ] 8 VUs  3m02.0s/4m0s

running (3m03.0s), 8/8 VUs, 8794 complete and 0 interrupted iterations
transient_retry_ingest   [  76% ] 8 VUs  3m03.0s/4m0s

running (3m04.0s), 8/8 VUs, 8842 complete and 0 interrupted iterations
transient_retry_ingest   [  77% ] 8 VUs  3m04.0s/4m0s

running (3m05.0s), 8/8 VUs, 8890 complete and 0 interrupted iterations
transient_retry_ingest   [  77% ] 8 VUs  3m05.0s/4m0s

running (3m06.0s), 8/8 VUs, 8938 complete and 0 interrupted iterations
transient_retry_ingest   [  77% ] 8 VUs  3m06.0s/4m0s

running (3m07.0s), 8/8 VUs, 8982 complete and 0 interrupted iterations
transient_retry_ingest   [  78% ] 8 VUs  3m07.0s/4m0s

running (3m08.0s), 8/8 VUs, 9030 complete and 0 interrupted iterations
transient_retry_ingest   [  78% ] 8 VUs  3m08.0s/4m0s

running (3m09.0s), 8/8 VUs, 9078 complete and 0 interrupted iterations
transient_retry_ingest   [  79% ] 8 VUs  3m09.0s/4m0s

running (3m10.0s), 8/8 VUs, 9127 complete and 0 interrupted iterations
transient_retry_ingest   [  79% ] 8 VUs  3m10.0s/4m0s

running (3m11.0s), 8/8 VUs, 9177 complete and 0 interrupted iterations
transient_retry_ingest   [  80% ] 8 VUs  3m11.0s/4m0s

running (3m12.0s), 8/8 VUs, 9227 complete and 0 interrupted iterations
transient_retry_ingest   [  80% ] 8 VUs  3m12.0s/4m0s

running (3m13.0s), 8/8 VUs, 9276 complete and 0 interrupted iterations
transient_retry_ingest   [  80% ] 8 VUs  3m13.0s/4m0s

running (3m14.0s), 8/8 VUs, 9325 complete and 0 interrupted iterations
transient_retry_ingest   [  81% ] 8 VUs  3m14.0s/4m0s

running (3m15.0s), 8/8 VUs, 9373 complete and 0 interrupted iterations
transient_retry_ingest   [  81% ] 8 VUs  3m15.0s/4m0s

running (3m16.0s), 8/8 VUs, 9421 complete and 0 interrupted iterations
transient_retry_ingest   [  82% ] 8 VUs  3m16.0s/4m0s

running (3m17.0s), 8/8 VUs, 9469 complete and 0 interrupted iterations
transient_retry_ingest   [  82% ] 8 VUs  3m17.0s/4m0s

running (3m18.0s), 8/8 VUs, 9513 complete and 0 interrupted iterations
transient_retry_ingest   [  82% ] 8 VUs  3m18.0s/4m0s

running (3m19.0s), 8/8 VUs, 9565 complete and 0 interrupted iterations
transient_retry_ingest   [  83% ] 8 VUs  3m19.0s/4m0s

running (3m20.0s), 8/8 VUs, 9614 complete and 0 interrupted iterations
transient_retry_ingest   [  83% ] 8 VUs  3m20.0s/4m0s

running (3m21.0s), 8/8 VUs, 9663 complete and 0 interrupted iterations
transient_retry_ingest   [  84% ] 8 VUs  3m21.0s/4m0s

running (3m22.0s), 8/8 VUs, 9711 complete and 0 interrupted iterations
transient_retry_ingest   [  84% ] 8 VUs  3m22.0s/4m0s

running (3m23.0s), 8/8 VUs, 9756 complete and 0 interrupted iterations
transient_retry_ingest   [  85% ] 8 VUs  3m23.0s/4m0s

running (3m24.0s), 8/8 VUs, 9802 complete and 0 interrupted iterations
transient_retry_ingest   [  85% ] 8 VUs  3m24.0s/4m0s

running (3m25.0s), 8/8 VUs, 9850 complete and 0 interrupted iterations
transient_retry_ingest   [  85% ] 8 VUs  3m25.0s/4m0s

running (3m26.0s), 8/8 VUs, 9898 complete and 0 interrupted iterations
transient_retry_ingest   [  86% ] 8 VUs  3m26.0s/4m0s

running (3m27.0s), 8/8 VUs, 9947 complete and 0 interrupted iterations
transient_retry_ingest   [  86% ] 8 VUs  3m27.0s/4m0s

running (3m28.0s), 8/8 VUs, 9996 complete and 0 interrupted iterations
transient_retry_ingest   [  87% ] 8 VUs  3m28.0s/4m0s

running (3m29.0s), 8/8 VUs, 10045 complete and 0 interrupted iterations
transient_retry_ingest   [  87% ] 8 VUs  3m29.0s/4m0s

running (3m30.0s), 8/8 VUs, 10093 complete and 0 interrupted iterations
transient_retry_ingest   [  87% ] 8 VUs  3m30.0s/4m0s

running (3m31.0s), 8/8 VUs, 10143 complete and 0 interrupted iterations
transient_retry_ingest   [  88% ] 8 VUs  3m31.0s/4m0s

running (3m32.0s), 8/8 VUs, 10193 complete and 0 interrupted iterations
transient_retry_ingest   [  88% ] 8 VUs  3m32.0s/4m0s

running (3m33.0s), 8/8 VUs, 10241 complete and 0 interrupted iterations
transient_retry_ingest   [  89% ] 8 VUs  3m33.0s/4m0s

running (3m34.0s), 8/8 VUs, 10289 complete and 0 interrupted iterations
transient_retry_ingest   [  89% ] 8 VUs  3m34.0s/4m0s

running (3m35.0s), 8/8 VUs, 10337 complete and 0 interrupted iterations
transient_retry_ingest   [  90% ] 8 VUs  3m35.0s/4m0s

running (3m36.0s), 8/8 VUs, 10371 complete and 0 interrupted iterations
transient_retry_ingest   [  90% ] 8 VUs  3m36.0s/4m0s

running (3m37.0s), 8/8 VUs, 10419 complete and 0 interrupted iterations
transient_retry_ingest   [  90% ] 8 VUs  3m37.0s/4m0s

running (3m38.0s), 8/8 VUs, 10467 complete and 0 interrupted iterations
transient_retry_ingest   [  91% ] 8 VUs  3m38.0s/4m0s

running (3m39.0s), 8/8 VUs, 10516 complete and 0 interrupted iterations
transient_retry_ingest   [  91% ] 8 VUs  3m39.0s/4m0s

running (3m40.0s), 8/8 VUs, 10569 complete and 0 interrupted iterations
transient_retry_ingest   [  92% ] 8 VUs  3m40.0s/4m0s

running (3m41.0s), 8/8 VUs, 10619 complete and 0 interrupted iterations
transient_retry_ingest   [  92% ] 8 VUs  3m41.0s/4m0s

running (3m42.0s), 8/8 VUs, 10668 complete and 0 interrupted iterations
transient_retry_ingest   [  92% ] 8 VUs  3m42.0s/4m0s

running (3m43.0s), 8/8 VUs, 10717 complete and 0 interrupted iterations
transient_retry_ingest   [  93% ] 8 VUs  3m43.0s/4m0s

running (3m44.0s), 8/8 VUs, 10755 complete and 0 interrupted iterations
transient_retry_ingest   [  93% ] 8 VUs  3m44.0s/4m0s

running (3m45.0s), 8/8 VUs, 10804 complete and 0 interrupted iterations
transient_retry_ingest   [  94% ] 8 VUs  3m45.0s/4m0s

running (3m46.0s), 8/8 VUs, 10850 complete and 0 interrupted iterations
transient_retry_ingest   [  94% ] 8 VUs  3m46.0s/4m0s

running (3m47.0s), 8/8 VUs, 10906 complete and 0 interrupted iterations
transient_retry_ingest   [  95% ] 8 VUs  3m47.0s/4m0s

running (3m48.0s), 8/8 VUs, 10947 complete and 0 interrupted iterations
transient_retry_ingest   [  95% ] 8 VUs  3m48.0s/4m0s

running (3m49.0s), 8/8 VUs, 10999 complete and 0 interrupted iterations
transient_retry_ingest   [  95% ] 8 VUs  3m49.0s/4m0s

running (3m50.0s), 8/8 VUs, 11043 complete and 0 interrupted iterations
transient_retry_ingest   [  96% ] 8 VUs  3m50.0s/4m0s

running (3m51.0s), 8/8 VUs, 11095 complete and 0 interrupted iterations
transient_retry_ingest   [  96% ] 8 VUs  3m51.0s/4m0s

running (3m52.0s), 8/8 VUs, 11143 complete and 0 interrupted iterations
transient_retry_ingest   [  97% ] 8 VUs  3m52.0s/4m0s

running (3m53.0s), 8/8 VUs, 11191 complete and 0 interrupted iterations
transient_retry_ingest   [  97% ] 8 VUs  3m53.0s/4m0s

running (3m54.0s), 8/8 VUs, 11231 complete and 0 interrupted iterations
transient_retry_ingest   [  97% ] 8 VUs  3m54.0s/4m0s

running (3m55.0s), 8/8 VUs, 11281 complete and 0 interrupted iterations
transient_retry_ingest   [  98% ] 8 VUs  3m55.0s/4m0s

running (3m56.0s), 8/8 VUs, 11331 complete and 0 interrupted iterations
transient_retry_ingest   [  98% ] 8 VUs  3m56.0s/4m0s

running (3m57.0s), 8/8 VUs, 11379 complete and 0 interrupted iterations
transient_retry_ingest   [  99% ] 8 VUs  3m57.0s/4m0s

running (3m58.0s), 8/8 VUs, 11427 complete and 0 interrupted iterations
transient_retry_ingest   [  99% ] 8 VUs  3m58.0s/4m0s

running (3m59.0s), 8/8 VUs, 11475 complete and 0 interrupted iterations
transient_retry_ingest   [ 100% ] 8 VUs  3m59.0s/4m0s

running (4m00.0s), 8/8 VUs, 11523 complete and 0 interrupted iterations
transient_retry_ingest   [ 100% ] 8 VUs  4m00.0s/4m0s


  █ THRESHOLDS 

    http_req_duration
    ✓ 'p(95)<3000' p(95)=19.07ms

    http_req_failed
    ✓ 'rate<0.03' rate=0.00%


  █ TOTAL RESULTS 

    checks_total.......: 23066   96.043158/s
    checks_succeeded...: 100.00% 23066 out of 23066
    checks_failed......: 0.00%   0 out of 23066

    ✓ signup ok
    ✓ session create ok
    ✓ job submit ok
    ✓ job status readable

    HTTP
    http_req_duration..............: avg=7.95ms  min=1.45ms   med=6.18ms   max=194.32ms p(90)=14.99ms  p(95)=19.07ms 
      { expected_response:true }...: avg=7.95ms  min=1.45ms   med=6.18ms   max=194.32ms p(90)=14.99ms  p(95)=19.07ms 
    http_req_failed................: 0.00% 0 out of 23066
    http_reqs......................: 23066 96.043158/s

    EXECUTION
    iteration_duration.............: avg=166.5ms min=154.51ms med=163.75ms max=407.81ms p(90)=177.92ms p(95)=184.05ms
    iterations.....................: 11532 48.017415/s
    vus............................: 8     min=8          max=8
    vus_max........................: 8     min=8          max=8

    NETWORK
    data_received..................: 14 MB 58 kB/s
    data_sent......................: 13 MB 55 kB/s




running (4m00.2s), 0/8 VUs, 11532 complete and 0 interrupted iterations
transient_retry_ingest ✓ [ 100% ] 8 VUs  4m0s
