
         /\      Grafana   /‾‾/  
    /\  /  \     |\  __   /  /   
   /  \/    \    | |/ /  /   ‾‾\ 
  /          \   |   (  |  (‾)  |
 / __________ \  |_|\_\  \_____/ 


     execution: local
        script: /Users/akshaybapat/drafted-mvp/tests/load/k6_jobs.js
        output: -

     scenarios: (100.00%) 1 scenario, 8 max VUs, 3m30s max duration (incl. graceful stop):
              * job_ingest: 8 looping VUs for 3m0s (gracefulStop: 30s)


running (0m01.0s), 8/8 VUs, 31 complete and 0 interrupted iterations
job_ingest   [   1% ] 8 VUs  0m01.0s/3m0s

running (0m02.0s), 8/8 VUs, 64 complete and 0 interrupted iterations
job_ingest   [   1% ] 8 VUs  0m02.0s/3m0s

running (0m03.0s), 8/8 VUs, 96 complete and 0 interrupted iterations
job_ingest   [   2% ] 8 VUs  0m03.0s/3m0s

running (0m04.0s), 8/8 VUs, 128 complete and 0 interrupted iterations
job_ingest   [   2% ] 8 VUs  0m04.0s/3m0s

running (0m05.0s), 8/8 VUs, 136 complete and 0 interrupted iterations
job_ingest   [   3% ] 8 VUs  0m05.0s/3m0s

running (0m06.0s), 8/8 VUs, 144 complete and 0 interrupted iterations
job_ingest   [   3% ] 8 VUs  0m06.0s/3m0s

running (0m07.0s), 8/8 VUs, 172 complete and 0 interrupted iterations
job_ingest   [   4% ] 8 VUs  0m07.0s/3m0s

running (0m08.0s), 8/8 VUs, 208 complete and 0 interrupted iterations
job_ingest   [   4% ] 8 VUs  0m08.0s/3m0s

running (0m09.0s), 8/8 VUs, 242 complete and 0 interrupted iterations
job_ingest   [   5% ] 8 VUs  0m09.0s/3m0s

running (0m10.0s), 8/8 VUs, 280 complete and 0 interrupted iterations
job_ingest   [   6% ] 8 VUs  0m10.0s/3m0s

running (0m11.0s), 8/8 VUs, 320 complete and 0 interrupted iterations
job_ingest   [   6% ] 8 VUs  0m11.0s/3m0s

running (0m12.0s), 8/8 VUs, 357 complete and 0 interrupted iterations
job_ingest   [   7% ] 8 VUs  0m12.0s/3m0s

running (0m13.0s), 8/8 VUs, 392 complete and 0 interrupted iterations
job_ingest   [   7% ] 8 VUs  0m13.0s/3m0s

running (0m14.0s), 8/8 VUs, 424 complete and 0 interrupted iterations
job_ingest   [   8% ] 8 VUs  0m14.0s/3m0s

running (0m15.0s), 8/8 VUs, 464 complete and 0 interrupted iterations
job_ingest   [   8% ] 8 VUs  0m15.0s/3m0s

running (0m16.0s), 8/8 VUs, 498 complete and 0 interrupted iterations
job_ingest   [   9% ] 8 VUs  0m16.0s/3m0s

running (0m17.0s), 8/8 VUs, 536 complete and 0 interrupted iterations
job_ingest   [   9% ] 8 VUs  0m17.0s/3m0s

running (0m18.0s), 8/8 VUs, 576 complete and 0 interrupted iterations
job_ingest   [  10% ] 8 VUs  0m18.0s/3m0s

running (0m19.0s), 8/8 VUs, 608 complete and 0 interrupted iterations
job_ingest   [  11% ] 8 VUs  0m19.0s/3m0s

running (0m20.0s), 8/8 VUs, 648 complete and 0 interrupted iterations
job_ingest   [  11% ] 8 VUs  0m20.0s/3m0s

running (0m21.0s), 8/8 VUs, 684 complete and 0 interrupted iterations
job_ingest   [  12% ] 8 VUs  0m21.0s/3m0s

running (0m22.0s), 8/8 VUs, 722 complete and 0 interrupted iterations
job_ingest   [  12% ] 8 VUs  0m22.0s/3m0s

running (0m23.0s), 8/8 VUs, 756 complete and 0 interrupted iterations
job_ingest   [  13% ] 8 VUs  0m23.0s/3m0s

running (0m24.0s), 8/8 VUs, 796 complete and 0 interrupted iterations
job_ingest   [  13% ] 8 VUs  0m24.0s/3m0s

running (0m25.0s), 8/8 VUs, 828 complete and 0 interrupted iterations
job_ingest   [  14% ] 8 VUs  0m25.0s/3m0s

running (0m26.0s), 8/8 VUs, 862 complete and 0 interrupted iterations
job_ingest   [  14% ] 8 VUs  0m26.0s/3m0s

running (0m27.0s), 8/8 VUs, 900 complete and 0 interrupted iterations
job_ingest   [  15% ] 8 VUs  0m27.0s/3m0s

running (0m28.0s), 8/8 VUs, 934 complete and 0 interrupted iterations
job_ingest   [  16% ] 8 VUs  0m28.0s/3m0s

running (0m29.0s), 8/8 VUs, 974 complete and 0 interrupted iterations
job_ingest   [  16% ] 8 VUs  0m29.0s/3m0s

running (0m30.0s), 8/8 VUs, 1014 complete and 0 interrupted iterations
job_ingest   [  17% ] 8 VUs  0m30.0s/3m0s

running (0m31.0s), 8/8 VUs, 1046 complete and 0 interrupted iterations
job_ingest   [  17% ] 8 VUs  0m31.0s/3m0s

running (0m32.0s), 8/8 VUs, 1078 complete and 0 interrupted iterations
job_ingest   [  18% ] 8 VUs  0m32.0s/3m0s

running (0m33.0s), 8/8 VUs, 1113 complete and 0 interrupted iterations
job_ingest   [  18% ] 8 VUs  0m33.0s/3m0s

running (0m34.0s), 8/8 VUs, 1150 complete and 0 interrupted iterations
job_ingest   [  19% ] 8 VUs  0m34.0s/3m0s

running (0m35.0s), 8/8 VUs, 1185 complete and 0 interrupted iterations
job_ingest   [  19% ] 8 VUs  0m35.0s/3m0s

running (0m36.0s), 8/8 VUs, 1222 complete and 0 interrupted iterations
job_ingest   [  20% ] 8 VUs  0m36.0s/3m0s

running (0m37.0s), 8/8 VUs, 1254 complete and 0 interrupted iterations
job_ingest   [  21% ] 8 VUs  0m37.0s/3m0s

running (0m38.0s), 8/8 VUs, 1294 complete and 0 interrupted iterations
job_ingest   [  21% ] 8 VUs  0m38.0s/3m0s

running (0m39.0s), 8/8 VUs, 1327 complete and 0 interrupted iterations
job_ingest   [  22% ] 8 VUs  0m39.0s/3m0s

running (0m40.0s), 8/8 VUs, 1366 complete and 0 interrupted iterations
job_ingest   [  22% ] 8 VUs  0m40.0s/3m0s

running (0m41.0s), 8/8 VUs, 1398 complete and 0 interrupted iterations
job_ingest   [  23% ] 8 VUs  0m41.0s/3m0s

running (0m42.0s), 8/8 VUs, 1438 complete and 0 interrupted iterations
job_ingest   [  23% ] 8 VUs  0m42.0s/3m0s

running (0m43.0s), 8/8 VUs, 1470 complete and 0 interrupted iterations
job_ingest   [  24% ] 8 VUs  0m43.0s/3m0s

running (0m44.0s), 8/8 VUs, 1502 complete and 0 interrupted iterations
job_ingest   [  24% ] 8 VUs  0m44.0s/3m0s

running (0m45.0s), 8/8 VUs, 1542 complete and 0 interrupted iterations
job_ingest   [  25% ] 8 VUs  0m45.0s/3m0s

running (0m46.0s), 8/8 VUs, 1574 complete and 0 interrupted iterations
job_ingest   [  26% ] 8 VUs  0m46.0s/3m0s

running (0m47.0s), 8/8 VUs, 1604 complete and 0 interrupted iterations
job_ingest   [  26% ] 8 VUs  0m47.0s/3m0s

running (0m48.0s), 8/8 VUs, 1639 complete and 0 interrupted iterations
job_ingest   [  27% ] 8 VUs  0m48.0s/3m0s

running (0m49.0s), 8/8 VUs, 1677 complete and 0 interrupted iterations
job_ingest   [  27% ] 8 VUs  0m49.0s/3m0s

running (0m50.0s), 8/8 VUs, 1714 complete and 0 interrupted iterations
job_ingest   [  28% ] 8 VUs  0m50.0s/3m0s

running (0m51.0s), 8/8 VUs, 1752 complete and 0 interrupted iterations
job_ingest   [  28% ] 8 VUs  0m51.0s/3m0s

running (0m52.0s), 8/8 VUs, 1791 complete and 0 interrupted iterations
job_ingest   [  29% ] 8 VUs  0m52.0s/3m0s

running (0m53.0s), 8/8 VUs, 1826 complete and 0 interrupted iterations
job_ingest   [  29% ] 8 VUs  0m53.0s/3m0s

running (0m54.0s), 8/8 VUs, 1864 complete and 0 interrupted iterations
job_ingest   [  30% ] 8 VUs  0m54.0s/3m0s

running (0m55.0s), 8/8 VUs, 1899 complete and 0 interrupted iterations
job_ingest   [  31% ] 8 VUs  0m55.0s/3m0s

running (0m56.0s), 8/8 VUs, 1939 complete and 0 interrupted iterations
job_ingest   [  31% ] 8 VUs  0m56.0s/3m0s

running (0m57.0s), 8/8 VUs, 1971 complete and 0 interrupted iterations
job_ingest   [  32% ] 8 VUs  0m57.0s/3m0s

running (0m58.0s), 8/8 VUs, 2011 complete and 0 interrupted iterations
job_ingest   [  32% ] 8 VUs  0m58.0s/3m0s

running (0m59.0s), 8/8 VUs, 2049 complete and 0 interrupted iterations
job_ingest   [  33% ] 8 VUs  0m59.0s/3m0s

running (1m00.0s), 8/8 VUs, 2087 complete and 0 interrupted iterations
job_ingest   [  33% ] 8 VUs  1m00.0s/3m0s

running (1m01.0s), 8/8 VUs, 2123 complete and 0 interrupted iterations
job_ingest   [  34% ] 8 VUs  1m01.0s/3m0s

running (1m02.0s), 8/8 VUs, 2163 complete and 0 interrupted iterations
job_ingest   [  34% ] 8 VUs  1m02.0s/3m0s

running (1m03.0s), 8/8 VUs, 2196 complete and 0 interrupted iterations
job_ingest   [  35% ] 8 VUs  1m03.0s/3m0s

running (1m04.0s), 8/8 VUs, 2232 complete and 0 interrupted iterations
job_ingest   [  36% ] 8 VUs  1m04.0s/3m0s

running (1m05.0s), 8/8 VUs, 2268 complete and 0 interrupted iterations
job_ingest   [  36% ] 8 VUs  1m05.0s/3m0s

running (1m06.0s), 8/8 VUs, 2308 complete and 0 interrupted iterations
job_ingest   [  37% ] 8 VUs  1m06.0s/3m0s

running (1m07.0s), 8/8 VUs, 2340 complete and 0 interrupted iterations
job_ingest   [  37% ] 8 VUs  1m07.0s/3m0s

running (1m08.0s), 8/8 VUs, 2374 complete and 0 interrupted iterations
job_ingest   [  38% ] 8 VUs  1m08.0s/3m0s

running (1m09.0s), 8/8 VUs, 2412 complete and 0 interrupted iterations
job_ingest   [  38% ] 8 VUs  1m09.0s/3m0s

running (1m10.0s), 8/8 VUs, 2448 complete and 0 interrupted iterations
job_ingest   [  39% ] 8 VUs  1m10.0s/3m0s

running (1m11.0s), 8/8 VUs, 2484 complete and 0 interrupted iterations
job_ingest   [  39% ] 8 VUs  1m11.0s/3m0s

running (1m12.0s), 8/8 VUs, 2520 complete and 0 interrupted iterations
job_ingest   [  40% ] 8 VUs  1m12.0s/3m0s

running (1m13.0s), 8/8 VUs, 2556 complete and 0 interrupted iterations
job_ingest   [  41% ] 8 VUs  1m13.0s/3m0s

running (1m14.0s), 8/8 VUs, 2589 complete and 0 interrupted iterations
job_ingest   [  41% ] 8 VUs  1m14.0s/3m0s

running (1m15.0s), 8/8 VUs, 2628 complete and 0 interrupted iterations
job_ingest   [  42% ] 8 VUs  1m15.0s/3m0s

running (1m16.0s), 8/8 VUs, 2664 complete and 0 interrupted iterations
job_ingest   [  42% ] 8 VUs  1m16.0s/3m0s

running (1m17.0s), 8/8 VUs, 2696 complete and 0 interrupted iterations
job_ingest   [  43% ] 8 VUs  1m17.0s/3m0s

running (1m18.0s), 8/8 VUs, 2728 complete and 0 interrupted iterations
job_ingest   [  43% ] 8 VUs  1m18.0s/3m0s

running (1m19.0s), 8/8 VUs, 2760 complete and 0 interrupted iterations
job_ingest   [  44% ] 8 VUs  1m19.0s/3m0s

running (1m20.0s), 8/8 VUs, 2792 complete and 0 interrupted iterations
job_ingest   [  44% ] 8 VUs  1m20.0s/3m0s

running (1m21.0s), 8/8 VUs, 2832 complete and 0 interrupted iterations
job_ingest   [  45% ] 8 VUs  1m21.0s/3m0s

running (1m22.0s), 8/8 VUs, 2864 complete and 0 interrupted iterations
job_ingest   [  46% ] 8 VUs  1m22.0s/3m0s

running (1m23.0s), 8/8 VUs, 2896 complete and 0 interrupted iterations
job_ingest   [  46% ] 8 VUs  1m23.0s/3m0s

running (1m24.0s), 8/8 VUs, 2928 complete and 0 interrupted iterations
job_ingest   [  47% ] 8 VUs  1m24.0s/3m0s

running (1m25.0s), 8/8 VUs, 2968 complete and 0 interrupted iterations
job_ingest   [  47% ] 8 VUs  1m25.0s/3m0s

running (1m26.0s), 8/8 VUs, 3000 complete and 0 interrupted iterations
job_ingest   [  48% ] 8 VUs  1m26.0s/3m0s

running (1m27.0s), 8/8 VUs, 3036 complete and 0 interrupted iterations
job_ingest   [  48% ] 8 VUs  1m27.0s/3m0s

running (1m28.0s), 8/8 VUs, 3072 complete and 0 interrupted iterations
job_ingest   [  49% ] 8 VUs  1m28.0s/3m0s

running (1m29.0s), 8/8 VUs, 3104 complete and 0 interrupted iterations
job_ingest   [  49% ] 8 VUs  1m29.0s/3m0s

running (1m30.0s), 8/8 VUs, 3136 complete and 0 interrupted iterations
job_ingest   [  50% ] 8 VUs  1m30.0s/3m0s

running (1m31.0s), 8/8 VUs, 3176 complete and 0 interrupted iterations
job_ingest   [  51% ] 8 VUs  1m31.0s/3m0s

running (1m32.0s), 8/8 VUs, 3208 complete and 0 interrupted iterations
job_ingest   [  51% ] 8 VUs  1m32.0s/3m0s

running (1m33.0s), 8/8 VUs, 3240 complete and 0 interrupted iterations
job_ingest   [  52% ] 8 VUs  1m33.0s/3m0s

running (1m34.0s), 8/8 VUs, 3272 complete and 0 interrupted iterations
job_ingest   [  52% ] 8 VUs  1m34.0s/3m0s

running (1m35.0s), 8/8 VUs, 3304 complete and 0 interrupted iterations
job_ingest   [  53% ] 8 VUs  1m35.0s/3m0s

running (1m36.0s), 8/8 VUs, 3344 complete and 0 interrupted iterations
job_ingest   [  53% ] 8 VUs  1m36.0s/3m0s

running (1m37.0s), 8/8 VUs, 3380 complete and 0 interrupted iterations
job_ingest   [  54% ] 8 VUs  1m37.0s/3m0s

running (1m38.0s), 8/8 VUs, 3416 complete and 0 interrupted iterations
job_ingest   [  54% ] 8 VUs  1m38.0s/3m0s

running (1m39.0s), 8/8 VUs, 3456 complete and 0 interrupted iterations
job_ingest   [  55% ] 8 VUs  1m39.0s/3m0s

running (1m40.0s), 8/8 VUs, 3489 complete and 0 interrupted iterations
job_ingest   [  56% ] 8 VUs  1m40.0s/3m0s

running (1m41.0s), 8/8 VUs, 3528 complete and 0 interrupted iterations
job_ingest   [  56% ] 8 VUs  1m41.0s/3m0s

running (1m42.0s), 8/8 VUs, 3565 complete and 0 interrupted iterations
job_ingest   [  57% ] 8 VUs  1m42.0s/3m0s

running (1m43.0s), 8/8 VUs, 3601 complete and 0 interrupted iterations
job_ingest   [  57% ] 8 VUs  1m43.0s/3m0s

running (1m44.0s), 8/8 VUs, 3637 complete and 0 interrupted iterations
job_ingest   [  58% ] 8 VUs  1m44.0s/3m0s

running (1m45.0s), 8/8 VUs, 3673 complete and 0 interrupted iterations
job_ingest   [  58% ] 8 VUs  1m45.0s/3m0s

running (1m46.0s), 8/8 VUs, 3713 complete and 0 interrupted iterations
job_ingest   [  59% ] 8 VUs  1m46.0s/3m0s

running (1m47.0s), 8/8 VUs, 3746 complete and 0 interrupted iterations
job_ingest   [  59% ] 8 VUs  1m47.0s/3m0s

running (1m48.0s), 8/8 VUs, 3785 complete and 0 interrupted iterations
job_ingest   [  60% ] 8 VUs  1m48.0s/3m0s

running (1m49.0s), 8/8 VUs, 3822 complete and 0 interrupted iterations
job_ingest   [  61% ] 8 VUs  1m49.0s/3m0s

running (1m50.0s), 8/8 VUs, 3859 complete and 0 interrupted iterations
job_ingest   [  61% ] 8 VUs  1m50.0s/3m0s

running (1m51.0s), 8/8 VUs, 3898 complete and 0 interrupted iterations
job_ingest   [  62% ] 8 VUs  1m51.0s/3m0s

running (1m52.0s), 8/8 VUs, 3931 complete and 0 interrupted iterations
job_ingest   [  62% ] 8 VUs  1m52.0s/3m0s

running (1m53.0s), 8/8 VUs, 3971 complete and 0 interrupted iterations
job_ingest   [  63% ] 8 VUs  1m53.0s/3m0s

running (1m54.0s), 8/8 VUs, 4003 complete and 0 interrupted iterations
job_ingest   [  63% ] 8 VUs  1m54.0s/3m0s

running (1m55.0s), 8/8 VUs, 4035 complete and 0 interrupted iterations
job_ingest   [  64% ] 8 VUs  1m55.0s/3m0s

running (1m56.0s), 8/8 VUs, 4071 complete and 0 interrupted iterations
job_ingest   [  64% ] 8 VUs  1m56.0s/3m0s

running (1m57.0s), 8/8 VUs, 4104 complete and 0 interrupted iterations
job_ingest   [  65% ] 8 VUs  1m57.0s/3m0s

running (1m58.0s), 8/8 VUs, 4143 complete and 0 interrupted iterations
job_ingest   [  66% ] 8 VUs  1m58.0s/3m0s

running (1m59.0s), 8/8 VUs, 4178 complete and 0 interrupted iterations
job_ingest   [  66% ] 8 VUs  1m59.0s/3m0s

running (2m00.0s), 8/8 VUs, 4216 complete and 0 interrupted iterations
job_ingest   [  67% ] 8 VUs  2m00.0s/3m0s

running (2m01.0s), 8/8 VUs, 4256 complete and 0 interrupted iterations
job_ingest   [  67% ] 8 VUs  2m01.0s/3m0s

running (2m02.0s), 8/8 VUs, 4290 complete and 0 interrupted iterations
job_ingest   [  68% ] 8 VUs  2m02.0s/3m0s

running (2m03.0s), 8/8 VUs, 4324 complete and 0 interrupted iterations
job_ingest   [  68% ] 8 VUs  2m03.0s/3m0s

running (2m04.0s), 8/8 VUs, 4362 complete and 0 interrupted iterations
job_ingest   [  69% ] 8 VUs  2m04.0s/3m0s

running (2m05.0s), 8/8 VUs, 4394 complete and 0 interrupted iterations
job_ingest   [  69% ] 8 VUs  2m05.0s/3m0s

running (2m06.0s), 8/8 VUs, 4421 complete and 0 interrupted iterations
job_ingest   [  70% ] 8 VUs  2m06.0s/3m0s

running (2m07.0s), 8/8 VUs, 4450 complete and 0 interrupted iterations
job_ingest   [  71% ] 8 VUs  2m07.0s/3m0s

running (2m08.0s), 8/8 VUs, 4482 complete and 0 interrupted iterations
job_ingest   [  71% ] 8 VUs  2m08.0s/3m0s

running (2m09.0s), 8/8 VUs, 4519 complete and 0 interrupted iterations
job_ingest   [  72% ] 8 VUs  2m09.0s/3m0s

running (2m10.0s), 8/8 VUs, 4554 complete and 0 interrupted iterations
job_ingest   [  72% ] 8 VUs  2m10.0s/3m0s

running (2m11.0s), 8/8 VUs, 4589 complete and 0 interrupted iterations
job_ingest   [  73% ] 8 VUs  2m11.0s/3m0s

running (2m12.0s), 8/8 VUs, 4627 complete and 0 interrupted iterations
job_ingest   [  73% ] 8 VUs  2m12.0s/3m0s

running (2m13.0s), 8/8 VUs, 4663 complete and 0 interrupted iterations
job_ingest   [  74% ] 8 VUs  2m13.0s/3m0s

running (2m14.0s), 8/8 VUs, 4701 complete and 0 interrupted iterations
job_ingest   [  74% ] 8 VUs  2m14.0s/3m0s

running (2m15.0s), 8/8 VUs, 4735 complete and 0 interrupted iterations
job_ingest   [  75% ] 8 VUs  2m15.0s/3m0s

running (2m16.0s), 8/8 VUs, 4775 complete and 0 interrupted iterations
job_ingest   [  76% ] 8 VUs  2m16.0s/3m0s

running (2m17.0s), 8/8 VUs, 4807 complete and 0 interrupted iterations
job_ingest   [  76% ] 8 VUs  2m17.0s/3m0s

running (2m18.0s), 8/8 VUs, 4807 complete and 0 interrupted iterations
job_ingest   [  77% ] 8 VUs  2m18.0s/3m0s

running (2m19.0s), 8/8 VUs, 4807 complete and 0 interrupted iterations
job_ingest   [  77% ] 8 VUs  2m19.0s/3m0s

running (2m20.0s), 8/8 VUs, 4807 complete and 0 interrupted iterations
job_ingest   [  78% ] 8 VUs  2m20.0s/3m0s

running (2m21.0s), 8/8 VUs, 4807 complete and 0 interrupted iterations
job_ingest   [  78% ] 8 VUs  2m21.0s/3m0s

running (2m22.0s), 8/8 VUs, 4807 complete and 0 interrupted iterations
job_ingest   [  79% ] 8 VUs  2m22.0s/3m0s

running (2m23.0s), 8/8 VUs, 4807 complete and 0 interrupted iterations
job_ingest   [  79% ] 8 VUs  2m23.0s/3m0s

running (2m24.0s), 8/8 VUs, 4807 complete and 0 interrupted iterations
job_ingest   [  80% ] 8 VUs  2m24.0s/3m0s

running (2m25.0s), 8/8 VUs, 4807 complete and 0 interrupted iterations
job_ingest   [  81% ] 8 VUs  2m25.0s/3m0s

running (2m26.0s), 8/8 VUs, 4807 complete and 0 interrupted iterations
job_ingest   [  81% ] 8 VUs  2m26.0s/3m0s

running (2m27.0s), 8/8 VUs, 4807 complete and 0 interrupted iterations
job_ingest   [  82% ] 8 VUs  2m27.0s/3m0s

running (2m28.0s), 8/8 VUs, 4807 complete and 0 interrupted iterations
job_ingest   [  82% ] 8 VUs  2m28.0s/3m0s

running (2m29.0s), 8/8 VUs, 4807 complete and 0 interrupted iterations
job_ingest   [  83% ] 8 VUs  2m29.0s/3m0s

running (2m30.0s), 8/8 VUs, 4842 complete and 0 interrupted iterations
job_ingest   [  83% ] 8 VUs  2m30.0s/3m0s

running (2m31.0s), 8/8 VUs, 4879 complete and 0 interrupted iterations
job_ingest   [  84% ] 8 VUs  2m31.0s/3m0s

running (2m32.0s), 8/8 VUs, 4911 complete and 0 interrupted iterations
job_ingest   [  84% ] 8 VUs  2m32.0s/3m0s

running (2m33.0s), 8/8 VUs, 4944 complete and 0 interrupted iterations
job_ingest   [  85% ] 8 VUs  2m33.0s/3m0s

running (2m34.0s), 8/8 VUs, 4979 complete and 0 interrupted iterations
job_ingest   [  86% ] 8 VUs  2m34.0s/3m0s

running (2m35.0s), 8/8 VUs, 5018 complete and 0 interrupted iterations
job_ingest   [  86% ] 8 VUs  2m35.0s/3m0s

running (2m36.0s), 8/8 VUs, 5051 complete and 0 interrupted iterations
job_ingest   [  87% ] 8 VUs  2m36.0s/3m0s

running (2m37.0s), 8/8 VUs, 5091 complete and 0 interrupted iterations
job_ingest   [  87% ] 8 VUs  2m37.0s/3m0s

running (2m38.0s), 8/8 VUs, 5123 complete and 0 interrupted iterations
job_ingest   [  88% ] 8 VUs  2m38.0s/3m0s

running (2m39.0s), 8/8 VUs, 5163 complete and 0 interrupted iterations
job_ingest   [  88% ] 8 VUs  2m39.0s/3m0s

running (2m40.0s), 8/8 VUs, 5195 complete and 0 interrupted iterations
job_ingest   [  89% ] 8 VUs  2m40.0s/3m0s

running (2m41.0s), 8/8 VUs, 5235 complete and 0 interrupted iterations
job_ingest   [  89% ] 8 VUs  2m41.0s/3m0s

running (2m42.0s), 8/8 VUs, 5267 complete and 0 interrupted iterations
job_ingest   [  90% ] 8 VUs  2m42.0s/3m0s

running (2m43.0s), 8/8 VUs, 5299 complete and 0 interrupted iterations
job_ingest   [  91% ] 8 VUs  2m43.0s/3m0s

running (2m44.0s), 8/8 VUs, 5332 complete and 0 interrupted iterations
job_ingest   [  91% ] 8 VUs  2m44.0s/3m0s

running (2m45.0s), 8/8 VUs, 5371 complete and 0 interrupted iterations
job_ingest   [  92% ] 8 VUs  2m45.0s/3m0s

running (2m46.0s), 8/8 VUs, 5404 complete and 0 interrupted iterations
job_ingest   [  92% ] 8 VUs  2m46.0s/3m0s

running (2m47.0s), 8/8 VUs, 5444 complete and 0 interrupted iterations
job_ingest   [  93% ] 8 VUs  2m47.0s/3m0s

running (2m48.0s), 8/8 VUs, 5476 complete and 0 interrupted iterations
job_ingest   [  93% ] 8 VUs  2m48.0s/3m0s

running (2m49.0s), 8/8 VUs, 5515 complete and 0 interrupted iterations
job_ingest   [  94% ] 8 VUs  2m49.0s/3m0s

running (2m50.0s), 8/8 VUs, 5548 complete and 0 interrupted iterations
job_ingest   [  94% ] 8 VUs  2m50.0s/3m0s

running (2m51.0s), 8/8 VUs, 5581 complete and 0 interrupted iterations
job_ingest   [  95% ] 8 VUs  2m51.0s/3m0s

running (2m52.0s), 8/8 VUs, 5618 complete and 0 interrupted iterations
job_ingest   [  96% ] 8 VUs  2m52.0s/3m0s

running (2m53.0s), 8/8 VUs, 5648 complete and 0 interrupted iterations
job_ingest   [  96% ] 8 VUs  2m53.0s/3m0s

running (2m54.0s), 8/8 VUs, 5680 complete and 0 interrupted iterations
job_ingest   [  97% ] 8 VUs  2m54.0s/3m0s

running (2m55.0s), 8/8 VUs, 5712 complete and 0 interrupted iterations
job_ingest   [  97% ] 8 VUs  2m55.0s/3m0s

running (2m56.0s), 8/8 VUs, 5746 complete and 0 interrupted iterations
job_ingest   [  98% ] 8 VUs  2m56.0s/3m0s

running (2m57.0s), 8/8 VUs, 5782 complete and 0 interrupted iterations
job_ingest   [  98% ] 8 VUs  2m57.0s/3m0s

running (2m58.0s), 8/8 VUs, 5818 complete and 0 interrupted iterations
job_ingest   [  99% ] 8 VUs  2m58.0s/3m0s

running (2m59.0s), 8/8 VUs, 5852 complete and 0 interrupted iterations
job_ingest   [  99% ] 8 VUs  2m59.0s/3m0s

running (3m00.0s), 8/8 VUs, 5883 complete and 0 interrupted iterations
job_ingest   [ 100% ] 8 VUs  3m00.0s/3m0s


  █ THRESHOLDS 

    http_req_duration
    ✓ 'p(95)<2000' p(95)=33.33ms

    http_req_failed
    ✓ 'rate<0.02' rate=0.00%


  █ TOTAL RESULTS 

    checks_total.......: 11786   65.313605/s
    checks_succeeded...: 100.00% 11786 out of 11786
    checks_failed......: 0.00%   0 out of 11786

    ✓ signup ok
    ✓ session create ok
    ✓ job submit ok
    ✓ job status readable

    HTTP
    http_req_duration..............: avg=21.93ms  min=1.62ms   med=8.93ms   max=12.04s p(90)=25.75ms  p(95)=33.33ms 
      { expected_response:true }...: avg=21.93ms  min=1.62ms   med=8.93ms   max=12.04s p(90)=25.75ms  p(95)=33.33ms 
    http_req_failed................: 0.00%  0 out of 11786
    http_reqs......................: 11786  65.313605/s

    EXECUTION
    iteration_duration.............: avg=244.75ms min=205.96ms med=220.16ms max=12.25s p(90)=249.03ms p(95)=261.08ms
    iterations.....................: 5892   32.651261/s
    vus............................: 8      min=8          max=8
    vus_max........................: 8      min=8          max=8

    NETWORK
    data_received..................: 7.2 MB 40 kB/s
    data_sent......................: 6.5 MB 36 kB/s




running (3m00.5s), 0/8 VUs, 5892 complete and 0 interrupted iterations
job_ingest ✓ [ 100% ] 8 VUs  3m0s
