
         /\      Grafana   /‾‾/  
    /\  /  \     |\  __   /  /   
   /  \/    \    | |/ /  /   ‾‾\ 
  /          \   |   (  |  (‾)  |
 / __________ \  |_|\_\  \_____/ 


     execution: local
        script: tests/load/k6_jobs.js
        output: -

     scenarios: (100.00%) 1 scenario, 8 max VUs, 3m30s max duration (incl. graceful stop):
              * job_ingest: 8 looping VUs for 3m0s (gracefulStop: 30s)


running (0m01.0s), 8/8 VUs, 32 complete and 0 interrupted iterations
job_ingest   [   1% ] 8 VUs  0m01.0s/3m0s

running (0m02.0s), 8/8 VUs, 64 complete and 0 interrupted iterations
job_ingest   [   1% ] 8 VUs  0m02.0s/3m0s

running (0m03.0s), 8/8 VUs, 96 complete and 0 interrupted iterations
job_ingest   [   2% ] 8 VUs  0m03.0s/3m0s

running (0m04.0s), 8/8 VUs, 129 complete and 0 interrupted iterations
job_ingest   [   2% ] 8 VUs  0m04.0s/3m0s

running (0m05.0s), 8/8 VUs, 168 complete and 0 interrupted iterations
job_ingest   [   3% ] 8 VUs  0m05.0s/3m0s

running (0m06.0s), 8/8 VUs, 208 complete and 0 interrupted iterations
job_ingest   [   3% ] 8 VUs  0m06.0s/3m0s

running (0m07.0s), 8/8 VUs, 241 complete and 0 interrupted iterations
job_ingest   [   4% ] 8 VUs  0m07.0s/3m0s

running (0m08.0s), 8/8 VUs, 273 complete and 0 interrupted iterations
job_ingest   [   4% ] 8 VUs  0m08.0s/3m0s

running (0m09.0s), 8/8 VUs, 305 complete and 0 interrupted iterations
job_ingest   [   5% ] 8 VUs  0m09.0s/3m0s

running (0m10.0s), 8/8 VUs, 342 complete and 0 interrupted iterations
job_ingest   [   6% ] 8 VUs  0m10.0s/3m0s

running (0m11.0s), 8/8 VUs, 377 complete and 0 interrupted iterations
job_ingest   [   6% ] 8 VUs  0m11.0s/3m0s

running (0m12.0s), 8/8 VUs, 417 complete and 0 interrupted iterations
job_ingest   [   7% ] 8 VUs  0m12.0s/3m0s

running (0m13.0s), 8/8 VUs, 454 complete and 0 interrupted iterations
job_ingest   [   7% ] 8 VUs  0m13.0s/3m0s

running (0m14.0s), 8/8 VUs, 489 complete and 0 interrupted iterations
job_ingest   [   8% ] 8 VUs  0m14.0s/3m0s

running (0m15.0s), 8/8 VUs, 521 complete and 0 interrupted iterations
job_ingest   [   8% ] 8 VUs  0m15.0s/3m0s

running (0m16.0s), 8/8 VUs, 553 complete and 0 interrupted iterations
job_ingest   [   9% ] 8 VUs  0m16.0s/3m0s

running (0m17.0s), 8/8 VUs, 586 complete and 0 interrupted iterations
job_ingest   [   9% ] 8 VUs  0m17.0s/3m0s

running (0m18.0s), 8/8 VUs, 625 complete and 0 interrupted iterations
job_ingest   [  10% ] 8 VUs  0m18.0s/3m0s

running (0m19.0s), 8/8 VUs, 658 complete and 0 interrupted iterations
job_ingest   [  11% ] 8 VUs  0m19.0s/3m0s

running (0m20.0s), 8/8 VUs, 691 complete and 0 interrupted iterations
job_ingest   [  11% ] 8 VUs  0m20.0s/3m0s

running (0m21.0s), 8/8 VUs, 731 complete and 0 interrupted iterations
job_ingest   [  12% ] 8 VUs  0m21.0s/3m0s

running (0m22.0s), 8/8 VUs, 764 complete and 0 interrupted iterations
job_ingest   [  12% ] 8 VUs  0m22.0s/3m0s

running (0m23.0s), 8/8 VUs, 803 complete and 0 interrupted iterations
job_ingest   [  13% ] 8 VUs  0m23.0s/3m0s

running (0m24.0s), 8/8 VUs, 837 complete and 0 interrupted iterations
job_ingest   [  13% ] 8 VUs  0m24.0s/3m0s

running (0m25.0s), 8/8 VUs, 869 complete and 0 interrupted iterations
job_ingest   [  14% ] 8 VUs  0m25.0s/3m0s

running (0m26.0s), 8/8 VUs, 907 complete and 0 interrupted iterations
job_ingest   [  14% ] 8 VUs  0m26.0s/3m0s

running (0m27.0s), 8/8 VUs, 941 complete and 0 interrupted iterations
job_ingest   [  15% ] 8 VUs  0m27.0s/3m0s

running (0m28.0s), 8/8 VUs, 978 complete and 0 interrupted iterations
job_ingest   [  16% ] 8 VUs  0m28.0s/3m0s

running (0m29.0s), 8/8 VUs, 1013 complete and 0 interrupted iterations
job_ingest   [  16% ] 8 VUs  0m29.0s/3m0s

running (0m30.0s), 8/8 VUs, 1045 complete and 0 interrupted iterations
job_ingest   [  17% ] 8 VUs  0m30.0s/3m0s

running (0m31.0s), 8/8 VUs, 1084 complete and 0 interrupted iterations
job_ingest   [  17% ] 8 VUs  0m31.0s/3m0s

running (0m32.0s), 8/8 VUs, 1117 complete and 0 interrupted iterations
job_ingest   [  18% ] 8 VUs  0m32.0s/3m0s

running (0m33.0s), 8/8 VUs, 1151 complete and 0 interrupted iterations
job_ingest   [  18% ] 8 VUs  0m33.0s/3m0s

running (0m34.0s), 8/8 VUs, 1189 complete and 0 interrupted iterations
job_ingest   [  19% ] 8 VUs  0m34.0s/3m0s

running (0m35.0s), 8/8 VUs, 1226 complete and 0 interrupted iterations
job_ingest   [  19% ] 8 VUs  0m35.0s/3m0s

running (0m36.0s), 8/8 VUs, 1261 complete and 0 interrupted iterations
job_ingest   [  20% ] 8 VUs  0m36.0s/3m0s

running (0m37.0s), 8/8 VUs, 1301 complete and 0 interrupted iterations
job_ingest   [  21% ] 8 VUs  0m37.0s/3m0s

running (0m38.0s), 8/8 VUs, 1333 complete and 0 interrupted iterations
job_ingest   [  21% ] 8 VUs  0m38.0s/3m0s

running (0m39.0s), 8/8 VUs, 1373 complete and 0 interrupted iterations
job_ingest   [  22% ] 8 VUs  0m39.0s/3m0s

running (0m40.0s), 8/8 VUs, 1408 complete and 0 interrupted iterations
job_ingest   [  22% ] 8 VUs  0m40.0s/3m0s

running (0m41.0s), 8/8 VUs, 1445 complete and 0 interrupted iterations
job_ingest   [  23% ] 8 VUs  0m41.0s/3m0s

running (0m42.0s), 8/8 VUs, 1477 complete and 0 interrupted iterations
job_ingest   [  23% ] 8 VUs  0m42.0s/3m0s

running (0m43.0s), 8/8 VUs, 1512 complete and 0 interrupted iterations
job_ingest   [  24% ] 8 VUs  0m43.0s/3m0s

running (0m44.0s), 8/8 VUs, 1549 complete and 0 interrupted iterations
job_ingest   [  24% ] 8 VUs  0m44.0s/3m0s

running (0m45.0s), 8/8 VUs, 1581 complete and 0 interrupted iterations
job_ingest   [  25% ] 8 VUs  0m45.0s/3m0s

running (0m46.0s), 8/8 VUs, 1613 complete and 0 interrupted iterations
job_ingest   [  26% ] 8 VUs  0m46.0s/3m0s

running (0m47.0s), 8/8 VUs, 1649 complete and 0 interrupted iterations
job_ingest   [  26% ] 8 VUs  0m47.0s/3m0s

running (0m48.0s), 8/8 VUs, 1685 complete and 0 interrupted iterations
job_ingest   [  27% ] 8 VUs  0m48.0s/3m0s

running (0m49.0s), 8/8 VUs, 1717 complete and 0 interrupted iterations
job_ingest   [  27% ] 8 VUs  0m49.0s/3m0s

running (0m50.0s), 8/8 VUs, 1757 complete and 0 interrupted iterations
job_ingest   [  28% ] 8 VUs  0m50.0s/3m0s

running (0m51.0s), 8/8 VUs, 1789 complete and 0 interrupted iterations
job_ingest   [  28% ] 8 VUs  0m51.0s/3m0s

running (0m52.0s), 8/8 VUs, 1829 complete and 0 interrupted iterations
job_ingest   [  29% ] 8 VUs  0m52.0s/3m0s

running (0m53.0s), 8/8 VUs, 1861 complete and 0 interrupted iterations
job_ingest   [  29% ] 8 VUs  0m53.0s/3m0s

running (0m54.0s), 8/8 VUs, 1894 complete and 0 interrupted iterations
job_ingest   [  30% ] 8 VUs  0m54.0s/3m0s

running (0m55.0s), 8/8 VUs, 1926 complete and 0 interrupted iterations
job_ingest   [  31% ] 8 VUs  0m55.0s/3m0s

running (0m56.0s), 8/8 VUs, 1966 complete and 0 interrupted iterations
job_ingest   [  31% ] 8 VUs  0m56.0s/3m0s

running (0m57.0s), 8/8 VUs, 2006 complete and 0 interrupted iterations
job_ingest   [  32% ] 8 VUs  0m57.0s/3m0s

running (0m58.0s), 8/8 VUs, 2038 complete and 0 interrupted iterations
job_ingest   [  32% ] 8 VUs  0m58.0s/3m0s

running (0m59.0s), 8/8 VUs, 2078 complete and 0 interrupted iterations
job_ingest   [  33% ] 8 VUs  0m59.0s/3m0s

running (1m00.0s), 8/8 VUs, 2118 complete and 0 interrupted iterations
job_ingest   [  33% ] 8 VUs  1m00.0s/3m0s

running (1m01.0s), 8/8 VUs, 2150 complete and 0 interrupted iterations
job_ingest   [  34% ] 8 VUs  1m01.0s/3m0s

running (1m02.0s), 8/8 VUs, 2190 complete and 0 interrupted iterations
job_ingest   [  34% ] 8 VUs  1m02.0s/3m0s

running (1m03.0s), 8/8 VUs, 2222 complete and 0 interrupted iterations
job_ingest   [  35% ] 8 VUs  1m03.0s/3m0s

running (1m04.0s), 8/8 VUs, 2262 complete and 0 interrupted iterations
job_ingest   [  36% ] 8 VUs  1m04.0s/3m0s

running (1m05.0s), 8/8 VUs, 2294 complete and 0 interrupted iterations
job_ingest   [  36% ] 8 VUs  1m05.0s/3m0s

running (1m06.0s), 8/8 VUs, 2326 complete and 0 interrupted iterations
job_ingest   [  37% ] 8 VUs  1m06.0s/3m0s

running (1m07.0s), 8/8 VUs, 2366 complete and 0 interrupted iterations
job_ingest   [  37% ] 8 VUs  1m07.0s/3m0s

running (1m08.0s), 8/8 VUs, 2398 complete and 0 interrupted iterations
job_ingest   [  38% ] 8 VUs  1m08.0s/3m0s

running (1m09.0s), 8/8 VUs, 2438 complete and 0 interrupted iterations
job_ingest   [  38% ] 8 VUs  1m09.0s/3m0s

running (1m10.0s), 8/8 VUs, 2470 complete and 0 interrupted iterations
job_ingest   [  39% ] 8 VUs  1m10.0s/3m0s

running (1m11.0s), 8/8 VUs, 2505 complete and 0 interrupted iterations
job_ingest   [  39% ] 8 VUs  1m11.0s/3m0s

running (1m12.0s), 8/8 VUs, 2542 complete and 0 interrupted iterations
job_ingest   [  40% ] 8 VUs  1m12.0s/3m0s

running (1m13.0s), 8/8 VUs, 2582 complete and 0 interrupted iterations
job_ingest   [  41% ] 8 VUs  1m13.0s/3m0s

running (1m14.0s), 8/8 VUs, 2614 complete and 0 interrupted iterations
job_ingest   [  41% ] 8 VUs  1m14.0s/3m0s

running (1m15.0s), 8/8 VUs, 2646 complete and 0 interrupted iterations
job_ingest   [  42% ] 8 VUs  1m15.0s/3m0s

running (1m16.0s), 8/8 VUs, 2686 complete and 0 interrupted iterations
job_ingest   [  42% ] 8 VUs  1m16.0s/3m0s

running (1m17.0s), 8/8 VUs, 2720 complete and 0 interrupted iterations
job_ingest   [  43% ] 8 VUs  1m17.0s/3m0s

running (1m18.0s), 8/8 VUs, 2758 complete and 0 interrupted iterations
job_ingest   [  43% ] 8 VUs  1m18.0s/3m0s

running (1m19.0s), 8/8 VUs, 2790 complete and 0 interrupted iterations
job_ingest   [  44% ] 8 VUs  1m19.0s/3m0s

running (1m20.0s), 8/8 VUs, 2822 complete and 0 interrupted iterations
job_ingest   [  44% ] 8 VUs  1m20.0s/3m0s

running (1m21.0s), 8/8 VUs, 2854 complete and 0 interrupted iterations
job_ingest   [  45% ] 8 VUs  1m21.0s/3m0s

running (1m22.0s), 8/8 VUs, 2886 complete and 0 interrupted iterations
job_ingest   [  46% ] 8 VUs  1m22.0s/3m0s

running (1m23.0s), 8/8 VUs, 2926 complete and 0 interrupted iterations
job_ingest   [  46% ] 8 VUs  1m23.0s/3m0s

running (1m24.0s), 8/8 VUs, 2959 complete and 0 interrupted iterations
job_ingest   [  47% ] 8 VUs  1m24.0s/3m0s

running (1m25.0s), 8/8 VUs, 2997 complete and 0 interrupted iterations
job_ingest   [  47% ] 8 VUs  1m25.0s/3m0s

running (1m26.0s), 8/8 VUs, 3029 complete and 0 interrupted iterations
job_ingest   [  48% ] 8 VUs  1m26.0s/3m0s

running (1m27.0s), 8/8 VUs, 3062 complete and 0 interrupted iterations
job_ingest   [  48% ] 8 VUs  1m27.0s/3m0s

running (1m28.0s), 8/8 VUs, 3097 complete and 0 interrupted iterations
job_ingest   [  49% ] 8 VUs  1m28.0s/3m0s

running (1m29.0s), 8/8 VUs, 3134 complete and 0 interrupted iterations
job_ingest   [  49% ] 8 VUs  1m29.0s/3m0s

running (1m30.0s), 8/8 VUs, 3167 complete and 0 interrupted iterations
job_ingest   [  50% ] 8 VUs  1m30.0s/3m0s

running (1m31.0s), 8/8 VUs, 3205 complete and 0 interrupted iterations
job_ingest   [  51% ] 8 VUs  1m31.0s/3m0s

running (1m32.0s), 8/8 VUs, 3239 complete and 0 interrupted iterations
job_ingest   [  51% ] 8 VUs  1m32.0s/3m0s

running (1m33.0s), 8/8 VUs, 3271 complete and 0 interrupted iterations
job_ingest   [  52% ] 8 VUs  1m33.0s/3m0s

running (1m34.0s), 8/8 VUs, 3306 complete and 0 interrupted iterations
job_ingest   [  52% ] 8 VUs  1m34.0s/3m0s

running (1m35.0s), 8/8 VUs, 3343 complete and 0 interrupted iterations
job_ingest   [  53% ] 8 VUs  1m35.0s/3m0s

running (1m36.0s), 8/8 VUs, 3380 complete and 0 interrupted iterations
job_ingest   [  53% ] 8 VUs  1m36.0s/3m0s

running (1m37.0s), 8/8 VUs, 3415 complete and 0 interrupted iterations
job_ingest   [  54% ] 8 VUs  1m37.0s/3m0s

running (1m38.0s), 8/8 VUs, 3448 complete and 0 interrupted iterations
job_ingest   [  54% ] 8 VUs  1m38.0s/3m0s

running (1m39.0s), 8/8 VUs, 3487 complete and 0 interrupted iterations
job_ingest   [  55% ] 8 VUs  1m39.0s/3m0s

running (1m40.0s), 8/8 VUs, 3521 complete and 0 interrupted iterations
job_ingest   [  56% ] 8 VUs  1m40.0s/3m0s

running (1m41.0s), 8/8 VUs, 3561 complete and 0 interrupted iterations
job_ingest   [  56% ] 8 VUs  1m41.0s/3m0s

running (1m42.0s), 8/8 VUs, 3595 complete and 0 interrupted iterations
job_ingest   [  57% ] 8 VUs  1m42.0s/3m0s

running (1m43.0s), 8/8 VUs, 3633 complete and 0 interrupted iterations
job_ingest   [  57% ] 8 VUs  1m43.0s/3m0s

running (1m44.0s), 8/8 VUs, 3673 complete and 0 interrupted iterations
job_ingest   [  58% ] 8 VUs  1m44.0s/3m0s

running (1m45.0s), 8/8 VUs, 3706 complete and 0 interrupted iterations
job_ingest   [  58% ] 8 VUs  1m45.0s/3m0s

running (1m46.0s), 8/8 VUs, 3746 complete and 0 interrupted iterations
job_ingest   [  59% ] 8 VUs  1m46.0s/3m0s

running (1m47.0s), 8/8 VUs, 3786 complete and 0 interrupted iterations
job_ingest   [  59% ] 8 VUs  1m47.0s/3m0s

running (1m48.0s), 8/8 VUs, 3822 complete and 0 interrupted iterations
job_ingest   [  60% ] 8 VUs  1m48.0s/3m0s

running (1m49.0s), 8/8 VUs, 3858 complete and 0 interrupted iterations
job_ingest   [  61% ] 8 VUs  1m49.0s/3m0s

running (1m50.0s), 8/8 VUs, 3898 complete and 0 interrupted iterations
job_ingest   [  61% ] 8 VUs  1m50.0s/3m0s

running (1m51.0s), 8/8 VUs, 3931 complete and 0 interrupted iterations
job_ingest   [  62% ] 8 VUs  1m51.0s/3m0s

running (1m52.0s), 8/8 VUs, 3970 complete and 0 interrupted iterations
job_ingest   [  62% ] 8 VUs  1m52.0s/3m0s

running (1m53.0s), 8/8 VUs, 4010 complete and 0 interrupted iterations
job_ingest   [  63% ] 8 VUs  1m53.0s/3m0s

running (1m54.0s), 8/8 VUs, 4050 complete and 0 interrupted iterations
job_ingest   [  63% ] 8 VUs  1m54.0s/3m0s

running (1m55.0s), 8/8 VUs, 4084 complete and 0 interrupted iterations
job_ingest   [  64% ] 8 VUs  1m55.0s/3m0s

running (1m56.0s), 8/8 VUs, 4122 complete and 0 interrupted iterations
job_ingest   [  64% ] 8 VUs  1m56.0s/3m0s

running (1m57.0s), 8/8 VUs, 4162 complete and 0 interrupted iterations
job_ingest   [  65% ] 8 VUs  1m57.0s/3m0s

running (1m58.0s), 8/8 VUs, 4196 complete and 0 interrupted iterations
job_ingest   [  66% ] 8 VUs  1m58.0s/3m0s

running (1m59.0s), 8/8 VUs, 4229 complete and 0 interrupted iterations
job_ingest   [  66% ] 8 VUs  1m59.0s/3m0s

running (2m00.0s), 8/8 VUs, 4268 complete and 0 interrupted iterations
job_ingest   [  67% ] 8 VUs  2m00.0s/3m0s

running (2m01.0s), 8/8 VUs, 4301 complete and 0 interrupted iterations
job_ingest   [  67% ] 8 VUs  2m01.0s/3m0s

running (2m02.0s), 8/8 VUs, 4341 complete and 0 interrupted iterations
job_ingest   [  68% ] 8 VUs  2m02.0s/3m0s

running (2m03.0s), 8/8 VUs, 4373 complete and 0 interrupted iterations
job_ingest   [  68% ] 8 VUs  2m03.0s/3m0s

running (2m04.0s), 8/8 VUs, 4413 complete and 0 interrupted iterations
job_ingest   [  69% ] 8 VUs  2m04.0s/3m0s

running (2m05.0s), 8/8 VUs, 4445 complete and 0 interrupted iterations
job_ingest   [  69% ] 8 VUs  2m05.0s/3m0s

running (2m06.0s), 8/8 VUs, 4485 complete and 0 interrupted iterations
job_ingest   [  70% ] 8 VUs  2m06.0s/3m0s

running (2m07.0s), 8/8 VUs, 4517 complete and 0 interrupted iterations
job_ingest   [  71% ] 8 VUs  2m07.0s/3m0s

running (2m08.0s), 8/8 VUs, 4557 complete and 0 interrupted iterations
job_ingest   [  71% ] 8 VUs  2m08.0s/3m0s

running (2m09.0s), 8/8 VUs, 4589 complete and 0 interrupted iterations
job_ingest   [  72% ] 8 VUs  2m09.0s/3m0s

running (2m10.0s), 8/8 VUs, 4629 complete and 0 interrupted iterations
job_ingest   [  72% ] 8 VUs  2m10.0s/3m0s

running (2m11.0s), 8/8 VUs, 4661 complete and 0 interrupted iterations
job_ingest   [  73% ] 8 VUs  2m11.0s/3m0s

running (2m12.0s), 8/8 VUs, 4701 complete and 0 interrupted iterations
job_ingest   [  73% ] 8 VUs  2m12.0s/3m0s

running (2m13.0s), 8/8 VUs, 4733 complete and 0 interrupted iterations
job_ingest   [  74% ] 8 VUs  2m13.0s/3m0s

running (2m14.0s), 8/8 VUs, 4768 complete and 0 interrupted iterations
job_ingest   [  74% ] 8 VUs  2m14.0s/3m0s

running (2m15.0s), 8/8 VUs, 4805 complete and 0 interrupted iterations
job_ingest   [  75% ] 8 VUs  2m15.0s/3m0s

running (2m16.0s), 8/8 VUs, 4837 complete and 0 interrupted iterations
job_ingest   [  76% ] 8 VUs  2m16.0s/3m0s

running (2m17.0s), 8/8 VUs, 4870 complete and 0 interrupted iterations
job_ingest   [  76% ] 8 VUs  2m17.0s/3m0s

running (2m18.0s), 8/8 VUs, 4909 complete and 0 interrupted iterations
job_ingest   [  77% ] 8 VUs  2m18.0s/3m0s

running (2m19.0s), 8/8 VUs, 4941 complete and 0 interrupted iterations
job_ingest   [  77% ] 8 VUs  2m19.0s/3m0s

running (2m20.0s), 8/8 VUs, 4976 complete and 0 interrupted iterations
job_ingest   [  78% ] 8 VUs  2m20.0s/3m0s

running (2m21.0s), 8/8 VUs, 5013 complete and 0 interrupted iterations
job_ingest   [  78% ] 8 VUs  2m21.0s/3m0s

running (2m22.0s), 8/8 VUs, 5045 complete and 0 interrupted iterations
job_ingest   [  79% ] 8 VUs  2m22.0s/3m0s

running (2m23.0s), 8/8 VUs, 5085 complete and 0 interrupted iterations
job_ingest   [  79% ] 8 VUs  2m23.0s/3m0s

running (2m24.0s), 8/8 VUs, 5093 complete and 0 interrupted iterations
job_ingest   [  80% ] 8 VUs  2m24.0s/3m0s

running (2m25.0s), 8/8 VUs, 5093 complete and 0 interrupted iterations
job_ingest   [  81% ] 8 VUs  2m25.0s/3m0s

running (2m26.0s), 8/8 VUs, 5093 complete and 0 interrupted iterations
job_ingest   [  81% ] 8 VUs  2m26.0s/3m0s

running (2m27.0s), 8/8 VUs, 5093 complete and 0 interrupted iterations
job_ingest   [  82% ] 8 VUs  2m27.0s/3m0s

running (2m28.0s), 8/8 VUs, 5093 complete and 0 interrupted iterations
job_ingest   [  82% ] 8 VUs  2m28.0s/3m0s

running (2m29.0s), 8/8 VUs, 5093 complete and 0 interrupted iterations
job_ingest   [  83% ] 8 VUs  2m29.0s/3m0s

running (2m30.0s), 8/8 VUs, 5093 complete and 0 interrupted iterations
job_ingest   [  83% ] 8 VUs  2m30.0s/3m0s

running (2m31.0s), 8/8 VUs, 5093 complete and 0 interrupted iterations
job_ingest   [  84% ] 8 VUs  2m31.0s/3m0s

running (2m32.0s), 8/8 VUs, 5093 complete and 0 interrupted iterations
job_ingest   [  84% ] 8 VUs  2m32.0s/3m0s

running (2m33.0s), 8/8 VUs, 5093 complete and 0 interrupted iterations
job_ingest   [  85% ] 8 VUs  2m33.0s/3m0s

running (2m34.0s), 8/8 VUs, 5093 complete and 0 interrupted iterations
job_ingest   [  86% ] 8 VUs  2m34.0s/3m0s

running (2m35.0s), 8/8 VUs, 5093 complete and 0 interrupted iterations
job_ingest   [  86% ] 8 VUs  2m35.0s/3m0s

running (2m36.0s), 8/8 VUs, 5117 complete and 0 interrupted iterations
job_ingest   [  87% ] 8 VUs  2m36.0s/3m0s

running (2m37.0s), 8/8 VUs, 5149 complete and 0 interrupted iterations
job_ingest   [  87% ] 8 VUs  2m37.0s/3m0s

running (2m38.0s), 8/8 VUs, 5181 complete and 0 interrupted iterations
job_ingest   [  88% ] 8 VUs  2m38.0s/3m0s

running (2m39.0s), 8/8 VUs, 5218 complete and 0 interrupted iterations
job_ingest   [  88% ] 8 VUs  2m39.0s/3m0s

running (2m40.0s), 8/8 VUs, 5250 complete and 0 interrupted iterations
job_ingest   [  89% ] 8 VUs  2m40.0s/3m0s

running (2m41.0s), 8/8 VUs, 5285 complete and 0 interrupted iterations
job_ingest   [  89% ] 8 VUs  2m41.0s/3m0s

running (2m42.0s), 8/8 VUs, 5314 complete and 0 interrupted iterations
job_ingest   [  90% ] 8 VUs  2m42.0s/3m0s

running (2m43.0s), 8/8 VUs, 5349 complete and 0 interrupted iterations
job_ingest   [  91% ] 8 VUs  2m43.0s/3m0s

running (2m44.0s), 8/8 VUs, 5386 complete and 0 interrupted iterations
job_ingest   [  91% ] 8 VUs  2m44.0s/3m0s

running (2m45.0s), 8/8 VUs, 5420 complete and 0 interrupted iterations
job_ingest   [  92% ] 8 VUs  2m45.0s/3m0s

running (2m46.0s), 8/8 VUs, 5455 complete and 0 interrupted iterations
job_ingest   [  92% ] 8 VUs  2m46.0s/3m0s

running (2m47.0s), 8/8 VUs, 5492 complete and 0 interrupted iterations
job_ingest   [  93% ] 8 VUs  2m47.0s/3m0s

running (2m48.0s), 8/8 VUs, 5532 complete and 0 interrupted iterations
job_ingest   [  93% ] 8 VUs  2m48.0s/3m0s

running (2m49.0s), 8/8 VUs, 5564 complete and 0 interrupted iterations
job_ingest   [  94% ] 8 VUs  2m49.0s/3m0s

running (2m50.0s), 8/8 VUs, 5601 complete and 0 interrupted iterations
job_ingest   [  94% ] 8 VUs  2m50.0s/3m0s

running (2m51.0s), 8/8 VUs, 5638 complete and 0 interrupted iterations
job_ingest   [  95% ] 8 VUs  2m51.0s/3m0s

running (2m52.0s), 8/8 VUs, 5670 complete and 0 interrupted iterations
job_ingest   [  96% ] 8 VUs  2m52.0s/3m0s

running (2m53.0s), 8/8 VUs, 5710 complete and 0 interrupted iterations
job_ingest   [  96% ] 8 VUs  2m53.0s/3m0s

running (2m54.0s), 8/8 VUs, 5742 complete and 0 interrupted iterations
job_ingest   [  97% ] 8 VUs  2m54.0s/3m0s

running (2m55.0s), 8/8 VUs, 5782 complete and 0 interrupted iterations
job_ingest   [  97% ] 8 VUs  2m55.0s/3m0s

running (2m56.0s), 8/8 VUs, 5814 complete and 0 interrupted iterations
job_ingest   [  98% ] 8 VUs  2m56.0s/3m0s

running (2m57.0s), 8/8 VUs, 5851 complete and 0 interrupted iterations
job_ingest   [  98% ] 8 VUs  2m57.0s/3m0s

running (2m58.0s), 8/8 VUs, 5886 complete and 0 interrupted iterations
job_ingest   [  99% ] 8 VUs  2m58.0s/3m0s

running (2m59.0s), 8/8 VUs, 5926 complete and 0 interrupted iterations
job_ingest   [  99% ] 8 VUs  2m59.0s/3m0s

running (3m00.0s), 8/8 VUs, 5959 complete and 0 interrupted iterations
job_ingest   [ 100% ] 8 VUs  3m00.0s/3m0s


  █ THRESHOLDS 

    http_req_duration
    ✓ 'p(95)<2000' p(95)=31.23ms

    http_req_failed
    ✓ 'rate<0.02' rate=0.00%


  █ TOTAL RESULTS 

    checks_total.......: 11936   66.236663/s
    checks_succeeded...: 100.00% 11936 out of 11936
    checks_failed......: 0.00%   0 out of 11936

    ✓ signup ok
    ✓ session create ok
    ✓ job submit ok
    ✓ job status readable

    HTTP
    http_req_duration..............: avg=20.28ms  min=1.53ms   med=8.98ms   max=12.05s p(90)=24.98ms  p(95)=31.23ms 
      { expected_response:true }...: avg=20.28ms  min=1.53ms   med=8.98ms   max=12.05s p(90)=24.98ms  p(95)=31.23ms 
    http_req_failed................: 0.00%  0 out of 11936
    http_reqs......................: 11936  66.236663/s

    EXECUTION
    iteration_duration.............: avg=241.42ms min=204.88ms med=220.49ms max=12.28s p(90)=246.17ms p(95)=256.13ms
    iterations.....................: 5967   33.112782/s
    vus............................: 8      min=8          max=8
    vus_max........................: 8      min=8          max=8

    NETWORK
    data_received..................: 7.4 MB 41 kB/s
    data_sent......................: 6.6 MB 37 kB/s




running (3m00.2s), 0/8 VUs, 5967 complete and 0 interrupted iterations
job_ingest ✓ [ 100% ] 8 VUs  3m0s
